id,name,owner,url,description,stars,forks,language,created_at,updated_at,open_issues,create_year,update_year
200,pipelines,kubeflow,https://github.com/kubeflow/pipelines,Machine Learning Pipelines for Kubeflow,3584,1616,Python,2018-05-12,2024-10-02,245,2018,2024
201,turkce-yapay-zeka-kaynaklari,deeplearningturkiye,https://github.com/deeplearningturkiye/turkce-yapay-zeka-kaynaklari,Türkiye'de yapılan derin öğrenme (deep learning) ve makine öğrenmesi (machine learning) çalışmalarının derlendiği sayfa.,2294,444,Jupyter Notebook,2017-10-17,2024-10-01,8,2017,2024
202,ggml,ggerganov,https://github.com/ggerganov/ggml,Tensor library for machine learning,10940,1006,C++,2022-09-18,2024-10-02,257,2022,2024
203,Machine-Learning-101,Achronus,https://github.com/Achronus/Machine-Learning-101,"Basics and findings of a range of different machine learning techniques. This includes Deep Learning, Computer Vision, Artificial Intelligence and Natural Language Processing (NLP).",42,26,Python,2018-02-14,2024-04-18,2,2018,2024
204,FlappyLearning,xviniette,https://github.com/xviniette/FlappyLearning,Program learning to play Flappy Bird by machine learning (Neuroevolution),3988,498,JavaScript,2016-07-24,2024-10-01,13,2016,2024
205,Machine-Learning-Web-Apps,Jcharis,https://github.com/Jcharis/Machine-Learning-Web-Apps,"Building and Embedding Machine Learning Model into a Web App(With Flask,Streamlit,etc)",563,568,Jupyter Notebook,2018-03-09,2024-09-28,9,2018,2024
206,mlflow,mlflow,https://github.com/mlflow/mlflow,Open source platform for the machine learning lifecycle,18425,4167,Python,2018-06-05,2024-10-02,1601,2018,2024
207,ML-notes,Sakura-gh,https://github.com/Sakura-gh/ML-notes,notes about machine learning,3312,919,HTML,2020-01-20,2024-09-29,4,2020,2024
208,DeepLearningProjectWorkflow,thomasj02,https://github.com/thomasj02/DeepLearningProjectWorkflow,"Machine Learning Workflow, from Andrew Ng's lecture at Deep Learning Summer School 2016",411,62,Jupyter Notebook,2017-03-05,2024-08-26,0,2017,2024
209,python-Machine-learning,Mryangkaitong,https://github.com/Mryangkaitong/python-Machine-learning,机器学习算法项目,845,329,Jupyter Notebook,2018-04-11,2024-10-02,1,2018,2024
210,MachineLearningWithPython,JerryKurata,https://github.com/JerryKurata/MachineLearningWithPython,Starter files for Pluralsight course: Understanding Machine Learning with Python,259,388,Jupyter Notebook,2016-04-24,2024-05-26,5,2016,2024
211,ml-agents,Unity-Technologies,https://github.com/Unity-Technologies/ml-agents,The Unity Machine Learning Agents Toolkit (ML-Agents) is an open-source project that enables games and simulations to serve as environments for training intelligent agents using deep reinforcement learning and imitation learning.,16982,4145,C#,2017-09-08,2024-10-02,44,2017,2024
212,learn-machine-learning-in-two-months,bangoc123,https://github.com/bangoc123/learn-machine-learning-in-two-months,Những kiến thức cần thiết để học tốt Machine Learning trong vòng 2 tháng. Essential Knowledge for learning Machine Learning in two months.,2051,655,Jupyter Notebook,2018-08-03,2024-09-26,3,2018,2024
213,Coursera-DeepLearning.AI-Stanford-University-Machine-Learning-Specialization,shantanu1109,https://github.com/shantanu1109/Coursera-DeepLearning.AI-Stanford-University-Machine-Learning-Specialization,"This Repository contains Solutions to the Quizes & Lab Assignments of the Machine Learning Specialization (2022) from Deeplearning.AI on Coursera taught by Andrew Ng, Eddy Shyu, Aarti Bagul, Geoff Ladwig.",104,63,Jupyter Notebook,2022-07-26,2024-09-29,0,2022,2024
214,AI-Chip,basicmi,https://github.com/basicmi/AI-Chip,"A list of ICs and IPs for AI, Machine Learning and Deep Learning.",1631,273,PHP,2017-08-09,2024-09-30,24,2017,2024
215,MLAI,maalvarezl,https://github.com/maalvarezl/MLAI,Machine Learning And Adaptive Intelligence Module,122,141,Jupyter Notebook,2019-09-29,2024-09-29,0,2019,2024
216,ml-course,girafe-ai,https://github.com/girafe-ai/ml-course,Open Machine Learning course,2186,1064,Jupyter Notebook,2019-02-01,2024-10-02,37,2019,2024
217,aws-machine-learning-university-accelerated-nlp,aws-samples,https://github.com/aws-samples/aws-machine-learning-university-accelerated-nlp,Machine Learning University: Accelerated Natural Language Processing Class,2328,610,Jupyter Notebook,2020-08-07,2024-10-01,3,2020,2024
218,notes-machine-learning,lijin-THU,https://github.com/lijin-THU/notes-machine-learning,鉴于我没有时间继续写这个东西，这个项目暂时废止,833,317,Jupyter Notebook,2016-03-06,2024-09-12,0,2016,2024
219,DL-workshop-series,Machine-Learning-Tokyo,https://github.com/Machine-Learning-Tokyo/DL-workshop-series,Material used for Deep Learning related workshops for Machine Learning Tokyo (MLT),936,252,Jupyter Notebook,2018-11-23,2024-09-11,1,2018,2024
220,MachineLearningNote,LeBron-Jian,https://github.com/LeBron-Jian/MachineLearningNote,,491,211,Jupyter Notebook,2020-04-02,2024-09-11,0,2020,2024
221,transformers,huggingface,https://github.com/huggingface/transformers,"???? Transformers: State-of-the-art Machine Learning for Pytorch, TensorFlow, and JAX.",132864,26497,Python,2018-10-29,2024-10-02,1462,2018,2024
222,machine-learning-online-2018,coding-blocks-archives,https://github.com/coding-blocks-archives/machine-learning-online-2018,ML Online Course Repository. Course videos on online.codingblocks.com,340,649,Jupyter Notebook,2018-07-18,2024-09-06,7,2018,2024
223,Reinforcement-Learning-Specialization,ChanchalKumarMaji,https://github.com/ChanchalKumarMaji/Reinforcement-Learning-Specialization,"[Coursera] Reinforcement Learning Specialization by ""University of Alberta"" & ""Alberta Machine Intelligence Institute""",186,119,Jupyter Notebook,2019-09-28,2024-09-25,1,2019,2024
224,Machine-Learning-Books-With-Python,tdpetrou,https://github.com/tdpetrou/Machine-Learning-Books-With-Python,"Chapter by Chapter notes, exercises and code for a variety of machine learning books using Python",931,585,Jupyter Notebook,2016-06-18,2024-09-09,0,2016,2024
225,Deep-learning-books,joeldg,https://github.com/joeldg/Deep-learning-books,"Books for machine learning, deep learning, math, NLP, CV, RL, etc",224,80,Jupyter Notebook,2020-07-03,2024-10-02,0,2020,2024
226,coursera-machine-learning,vugsus,https://github.com/vugsus/coursera-machine-learning,Coursera's Machine Learning by Andrew Ng,345,442,MATLAB,2015-08-20,2024-09-06,3,2015,2024
227,cog,replicate,https://github.com/replicate/cog,Containers for machine learning,7897,550,Python,2021-02-26,2024-10-02,426,2021,2024
228,AIML-Projects,sharmapratik88,https://github.com/sharmapratik88/AIML-Projects,Projects I completed as a part of Great Learning's PGP - Artificial Intelligence and Machine Learning,137,77,Jupyter Notebook,2019-10-20,2024-09-27,0,2019,2024
229,Machine-Learning-Path,ahmadmustafaanis,https://github.com/ahmadmustafaanis/Machine-Learning-Path,Best courses from around the web to learn Artificial Intelligence,68,15,Jupyter Notebook,2020-02-03,2024-09-10,0,2020,2024
230,awesome-ml-for-cybersecurity,jivoi,https://github.com/jivoi/awesome-ml-for-cybersecurity, :octocat: Machine Learning for Cyber Security,7190,1749,Jupyter Notebook,2016-12-20,2024-10-02,12,2016,2024
231,Machine-Learning-Book,yuanxiaosc,https://github.com/yuanxiaosc/Machine-Learning-Book,《机器学习宝典》包含：谷歌机器学习速成课程（招式）+机器学习术语表（口诀）+机器学习规则（心得）+机器学习中的常识性问题 （内功）。该资源适用于机器学习、深度学习研究人员和爱好者参考！,1051,264,Jupyter Notebook,2019-05-26,2024-09-25,0,2019,2024
232,notes-LSJU-machine-learning,zlotus,https://github.com/zlotus/notes-LSJU-machine-learning,机器学习笔记,993,387,Jupyter Notebook,2016-06-15,2024-10-02,1,2016,2024
233,Azure-MachineLearning-DataScience,Azure-Samples,https://github.com/Azure-Samples/Azure-MachineLearning-DataScience,,409,369,HTML,2014-10-07,2024-09-25,15,2014,2024
234,machine-learning-curriculum,offchan42,https://github.com/offchan42/machine-learning-curriculum,:computer: Learn to make machines learn so that you don't have to struggle to program them; The ultimate list,1092,254,Jupyter Notebook,2016-12-12,2024-10-02,0,2016,2024
235,qiskit-machine-learning,qiskit-community,https://github.com/qiskit-community/qiskit-machine-learning,Quantum Machine Learning,657,322,Python,2021-02-27,2024-10-02,30,2021,2024
236,Handwritten-Digit-Recognition-using-Deep-Learning,anujdutt9,https://github.com/anujdutt9/Handwritten-Digit-Recognition-using-Deep-Learning,Handwritten Digit Recognition using Machine Learning and Deep Learning,220,128,Python,2017-01-01,2024-09-29,0,2017,2024
237,Machine-Learning-for-Cyber-Security,wtsxDev,https://github.com/wtsxDev/Machine-Learning-for-Cyber-Security,Curated list of tools and resources related to the use of machine learning for cyber security,1453,439,Jupyter Notebook,2017-01-15,2024-09-23,5,2017,2024
238,Deep-Learning-Machine-Learning-AI-TensorFlow-Python,IDouble,https://github.com/IDouble/Deep-Learning-Machine-Learning-AI-TensorFlow-Python,???? A Collection of Notes for Learning & Understanding Deep Learning / Machine Learning / Artificial Intelligence (AI) with TensorFlow ????,35,13,Python,2018-11-28,2024-09-17,3,2018,2024
239,awesome-adversarial-machine-learning,yenchenlin,https://github.com/yenchenlin/awesome-adversarial-machine-learning,A curated list of awesome adversarial machine learning resources,1802,283,Jupyter Notebook,2016-12-19,2024-09-29,5,2016,2024
240,facets,PAIR-code,https://github.com/PAIR-code/facets,Visualizations for machine learning datasets,7350,887,Jupyter Notebook,2017-07-07,2024-09-30,82,2017,2024
241,Machine_Learning_Journey,llSourcell,https://github.com/llSourcell/Machine_Learning_Journey,"This is the Curriculum for ""Machine Learning Journey"" By Siraj Raval on Youtube",973,256,Jupyter Notebook,2018-07-02,2024-09-03,2,2018,2024
242,interpretable-ml-book,christophM,https://github.com/christophM/interpretable-ml-book,Book about interpretable machine learning,4764,1055,Jupyter Notebook,2017-03-22,2024-10-02,44,2017,2024
243,DL-ML-project,roguesir,https://github.com/roguesir/DL-ML-project,Deep Learning and Machine Learning project,118,95,Python,2017-07-15,2024-09-16,2,2017,2024
244,Awesome-Federated-Machine-Learning,innovation-cat,https://github.com/innovation-cat/Awesome-Federated-Machine-Learning,"Everything about federated learning, including research papers, books, codes, tutorials, videos and beyond",1737,265,Jupyter Notebook,2019-10-19,2024-10-02,3,2019,2024
245,MachineLearning-C---code,pennyliang,https://github.com/pennyliang/MachineLearning-C---code,using c++ code to show the example of machine learning,481,232,C++,2012-02-28,2024-09-03,2,2012,2024
246,Machine-Learning-With-Python,Thinkgamer,https://github.com/Thinkgamer/Machine-Learning-With-Python,此项目是我在学习《机器学习实战》这本书时的代码记录情况，用python实现，当然也会包括一些其他的机器学习算法，使用Python实现,702,393,TSQL,2016-05-09,2024-09-24,0,2016,2024
247,ml-engineering,stas00,https://github.com/stas00/ml-engineering,Machine Learning Engineering Open Book,11088,663,Python,2020-09-02,2024-10-02,2,2020,2024
248,neoml,neoml-lib,https://github.com/neoml-lib/neoml,Machine learning framework for both deep learning and traditional algorithms,765,126,C++,2020-06-14,2024-09-30,32,2020,2024
249,machine-learning-surveys,metrofun,https://github.com/metrofun/machine-learning-surveys,"A curated list of Machine Learning Surveys, Tutorials and Books.",1361,203,JavaScript,2017-05-24,2024-09-26,3,2017,2024
250,NBA-Machine-Learning-Sports-Betting,kyleskom,https://github.com/kyleskom/NBA-Machine-Learning-Sports-Betting,NBA sports betting using machine learning,1178,431,Python,2019-11-29,2024-10-02,14,2019,2024
251,machine_learning_python,SmallVagetable,https://github.com/SmallVagetable/machine_learning_python,通过阅读网上的资料代码，进行自我加工，努力实现常用的机器学习算法。实现算法有KNN、Kmeans、EM、Perceptron、决策树、逻辑回归、svm、adaboost、朴素贝叶斯,717,267,Python,2019-01-10,2024-10-02,4,2019,2024
252,machine-learning-octave,trekhleb,https://github.com/trekhleb/machine-learning-octave,???? MatLab/Octave examples of popular machine learning algorithms with code examples and mathematics being explained,845,247,MATLAB,2018-10-19,2024-09-28,0,2018,2024
253,Udemy---Machine-Learning,jmportilla,https://github.com/jmportilla/Udemy---Machine-Learning,Notebooks for Course,238,428,Jupyter Notebook,2015-04-27,2024-09-17,1,2015,2024
254,PacMan-AI,TuringKi,https://github.com/TuringKi/PacMan-AI,PacMan Machine Learning Artificial Intelligence Project,16,33,Python,2014-12-01,2024-06-26,0,2014,2024
255,Machine_Learning_Tutorials,maelfabien,https://github.com/maelfabien/Machine_Learning_Tutorials,"Code, exercises and tutorials of my personal blog ! ????",777,258,Jupyter Notebook,2019-04-04,2024-09-22,1,2019,2024
256,Machine-Learning_ZhouZhihua,PnYuan,https://github.com/PnYuan/Machine-Learning_ZhouZhihua,"Exercises answers to the book ""machine-learning"" written by Prof. Zhou Zhihua of Nanjing University",521,430,HTML,2017-03-14,2024-10-02,3,2017,2024
257,conference_call_for_paper,JackieTseng,https://github.com/JackieTseng/conference_call_for_paper,"2021-2022 International Conferences in Artificial Intelligence, Machine Learning, Computer Vision, Data Mining, Natural Language Processing and Robotics",862,128,HTML,2017-11-11,2024-09-05,5,2017,2024
258,Advanced-Deep-Trading,Rachnog,https://github.com/Rachnog/Advanced-Deep-Trading,"Mostly experiments based on ""Advances in financial machine learning"" book",542,214,Jupyter Notebook,2019-02-16,2024-09-22,5,2019,2024
259,ML,RubixML,https://github.com/RubixML/ML,A high-level machine learning and deep learning library for the PHP language.,2027,182,PHP,2018-02-14,2024-10-01,63,2018,2024
260,Book7_Visualizations-for-Machine-Learning,Visualize-ML,https://github.com/Visualize-ML/Book7_Visualizations-for-Machine-Learning,Book_7_《机器学习》 |   鸢尾花书：从加减乘除到机器学习；欢迎批评指正,2347,450,Jupyter Notebook,2022-10-11,2024-10-02,0,2022,2024
261,Awesome-Mobility-Machine-Learning-Contents,zzsza,https://github.com/zzsza/Awesome-Mobility-Machine-Learning-Contents,Machine Learning / Deep Learning Contents in Mobility Industry(Transportation),267,74,Jupyter Notebook,2019-04-29,2024-09-08,1,2019,2024
262,auto-sklearn,automl,https://github.com/automl/auto-sklearn,Automated Machine Learning with scikit-learn,7575,1279,Python,2015-07-02,2024-10-01,199,2015,2024
263,Repo-2017,RubensZimbres,https://github.com/RubensZimbres/Repo-2017,"My first Python repo with codes in Machine Learning, NLP and Deep Learning with Keras and Theano",1191,678,Python,2016-12-17,2024-08-23,1,2016,2024
264,MachineLearningTrick,lytforgood,https://github.com/lytforgood/MachineLearningTrick,Machine Learning Trick : GBDT_Feature Blending Stacking CascadeForest,367,179,Python,2017-03-22,2024-08-26,3,2017,2024
265,SynapseML,microsoft,https://github.com/microsoft/SynapseML,Simple and Distributed Machine Learning,5053,830,Scala,2017-06-05,2024-10-01,373,2017,2024
266,Artificial-Intelligence-and-Machine-Learning-Fundamentals,TrainingByPackt,https://github.com/TrainingByPackt/Artificial-Intelligence-and-Machine-Learning-Fundamentals,Get started with the development of real-world applications that are powered by the latest AI advances,22,16,Python,2018-10-05,2024-06-18,0,2018,2024
267,introduction-to-machine-learning-archived,gaih,https://github.com/gaih/introduction-to-machine-learning-archived,,567,520,Jupyter Notebook,2020-12-10,2024-09-30,3,2020,2024
268,business-machine-learning,firmai,https://github.com/firmai/business-machine-learning,"A curated list of practical business machine learning (BML) and business data science (BDS) applications for Accounting, Customer, Employee, Legal, Management and Operations (by @firmai)",765,225,Jupyter Notebook,2019-02-19,2024-10-01,0,2019,2024
269,machinelearninginaction,pbharrin,https://github.com/pbharrin/machinelearninginaction,Source Code for the book: Machine Learning in Action published by Manning,2369,1800,HTML,2011-05-04,2024-09-19,14,2011,2024
270,Awesome-Rust-MachineLearning,vaaaaanquish,https://github.com/vaaaaanquish/Awesome-Rust-MachineLearning,"This repository is a list of machine learning libraries written in Rust. It's a compilation of GitHub repositories, blogs, books, movies, discussions, papers, etc. ????",1890,104,JavaScript,2021-02-23,2024-10-01,4,2021,2024
271,machine_learning_derivation,ws13685555932,https://github.com/ws13685555932/machine_learning_derivation,notes of machine learning algorithm derivation,740,220,Jupyter Notebook,2019-05-11,2024-09-28,11,2019,2024
272,Stanford-Machine-Learning-Course,zhouxc,https://github.com/zhouxc/Stanford-Machine-Learning-Course,machine learning course programming exercise,527,355,MATLAB,2011-12-25,2024-09-27,1,2011,2024
273,Python-Machine-Learning-Cookbook,PacktPublishing,https://github.com/PacktPublishing/Python-Machine-Learning-Cookbook,Code files for  Python-Machine-Learning-Cookbook,448,385,Python,2016-06-09,2024-09-28,3,2016,2024
274,handson-ml3,ageron,https://github.com/ageron/handson-ml3,"A series of Jupyter notebooks that walk you through the fundamentals of Machine Learning and Deep Learning in Python using Scikit-Learn, Keras and TensorFlow 2.",7461,3011,Jupyter Notebook,2022-02-19,2024-10-02,101,2022,2024
275,Machine-Learning-in-Action-Python3,wzy6642,https://github.com/wzy6642/Machine-Learning-in-Action-Python3,《机器学习实战》的python3源码,1286,471,HTML,2018-12-28,2024-10-01,10,2018,2024
276,ML-Notebooks,dair-ai,https://github.com/dair-ai/ML-Notebooks,:fire: Machine Learning Notebooks,3275,518,Jupyter Notebook,2022-03-26,2024-09-30,2,2022,2024
277,approachingalmost,abhishekkrthakur,https://github.com/abhishekkrthakur/approachingalmost,Approaching (Almost) Any Machine Learning Problem,7302,1047,Jupyter Notebook,2020-07-04,2024-10-02,54,2020,2024
278,Hands-On-Machine-Learning-for-Algorithmic-Trading,PacktPublishing,https://github.com/PacktPublishing/Hands-On-Machine-Learning-for-Algorithmic-Trading,"Hands-On Machine Learning for Algorithmic Trading, published by Packt",1421,629,Jupyter Notebook,2019-05-07,2024-10-01,4,2019,2024
279,Practical-Machine-Learning,youssefHosni,https://github.com/youssefHosni/Practical-Machine-Learning,Practical machine learning notebook & articles covers the machine learning end to end life cycle.,917,199,Jupyter Notebook,2022-09-14,2024-09-27,0,2022,2024
280,CourseraMachineLearning,vkosuri,https://github.com/vkosuri/CourseraMachineLearning,Coursera Machine Learning By Prof. Andrew Ng,517,250,MATLAB,2017-09-14,2024-10-01,0,2017,2024
281,ABAGAIL,pushkar,https://github.com/pushkar/ABAGAIL,The library contains a number of interconnected Java packages that implement machine learning and artificial intelligence algorithms. These are artificial intelligence algorithms implemented for the kind of people that like to implement algorithms themselves.,247,487,Java,2013-03-05,2024-08-14,6,2013,2024
282,AndroidTensorFlowMachineLearningExample,amitshekhariitbhu,https://github.com/amitshekhariitbhu/AndroidTensorFlowMachineLearningExample,Android TensorFlow MachineLearning Example (Building TensorFlow for Android),1434,429,Java,2017-03-06,2024-09-26,13,2017,2024
283,Machine_Learning_Resources,wangyuGithub01,https://github.com/wangyuGithub01/Machine_Learning_Resources,:fish::fish::fish: 机器学习面试复习资源,1117,174,Jupyter Notebook,2019-02-28,2024-09-29,0,2019,2024
284,machine-learning-module,josephmisiti,https://github.com/josephmisiti/machine-learning-module,the best machine learning tutorials on the web,465,255,Objective-C,2011-04-28,2024-08-14,0,2011,2024
285,machine-learning-with-ruby,arbox,https://github.com/arbox/machine-learning-with-ruby,Curated list: Resources for machine learning in Ruby,2113,180,Ruby,2017-04-20,2024-10-02,6,2017,2024
286,machinelearning-samples,dotnet,https://github.com/dotnet/machinelearning-samples,"Samples for ML.NET, an open source and cross-platform machine learning framework for .NET.",4472,2679,PowerShell,2018-05-25,2024-09-30,209,2018,2024
287,Machine-Learning-in-Action,TeFuirnever,https://github.com/TeFuirnever/Machine-Learning-in-Action,⚡️⚡️⚡️《机器学习实战》代码（基于Python3）????,832,268,Python,2019-10-08,2024-09-29,0,2019,2024
288,auto-maple,tanjeffreyz,https://github.com/tanjeffreyz/auto-maple,Artificial intelligence software for MapleStory that uses various machine learning and computer vision techniques to navigate challenging in-game environments,446,224,Python,2021-04-14,2024-09-30,50,2021,2024
289,ML-Tutorial-Experiment,jiqizhixin,https://github.com/jiqizhixin/ML-Tutorial-Experiment,Coding the Machine Learning Tutorial for Learning to Learn,2506,734,Jupyter Notebook,2017-08-28,2024-09-26,7,2017,2024
290,Machine-Learning-From-Scratch,RRdmlearning,https://github.com/RRdmlearning/Machine-Learning-From-Scratch,常用机器学习的算法简洁实现,642,287,Python,2017-12-14,2024-09-25,4,2017,2024
291,Machine-learning-for-proteins,yangkky,https://github.com/yangkky/Machine-learning-for-proteins,Listing of papers about machine learning for proteins. ,1492,198,Jupyter Notebook,2019-05-10,2024-09-29,19,2019,2024
292,book-mlearn-gyomu,kujirahand,https://github.com/kujirahand/book-mlearn-gyomu,Book sample (AI Machine-learning Deep-learning),124,93,Jupyter Notebook,2018-06-03,2024-09-23,0,2018,2024
293,Book_List,mukeshmithrakumar,https://github.com/mukeshmithrakumar/Book_List,"Python, Machine Learning, Deep Learning and Data Science Books",221,122,Jupyter Notebook,2019-11-16,2024-10-02,0,2019,2024
294,aihub,thibo73800,https://github.com/thibo73800/aihub,"I use this repository for my Youtube channel where I share videos about Artificial Intelligence. The repository includes Machine Learning, Deep Learning, and Reinforcement learning's code.",165,61,Jupyter Notebook,2018-09-24,2024-08-26,1,2018,2024
295,machine_learning_with_python_jadi,jadijadi,https://github.com/jadijadi/machine_learning_with_python_jadi,The notebooks we use on ML course,807,354,Jupyter Notebook,2021-09-20,2024-10-01,10,2021,2024
296,ml-road,yanshengjia,https://github.com/yanshengjia/ml-road,"Machine Learning Resources, Practice and Research",3318,1231,Python,2017-10-31,2024-10-02,5,2017,2024
297,Swift-AI,Swift-AI,https://github.com/Swift-AI/Swift-AI,The Swift machine learning library.,6027,554,Swift,2015-11-19,2024-09-28,10,2015,2024
298,aws-machine-learning-university-accelerated-cv,aws-samples,https://github.com/aws-samples/aws-machine-learning-university-accelerated-cv,Machine Learning University: Accelerated Computer Vision Class,1575,364,Jupyter Notebook,2020-07-29,2024-10-02,2,2020,2024
299,dl-setup,floydhub,https://github.com/floydhub/dl-setup,Instructions for setting up the software on your deep learning machine,1980,326,Jupyter Notebook,2016-05-02,2024-09-23,7,2016,2024
300,h2o-3,h2oai,https://github.com/h2oai/h2o-3,"H2O is an Open Source, Distributed, Fast & Scalable Machine Learning Platform: Deep Learning, Gradient Boosting (GBM) & XGBoost, Random Forest, Generalized Linear Modeling (GLM with Elastic Net), K-Means, PCA, Generalized Additive Models (GAM), RuleFit, Support Vector Machine (SVM), Stacked Ensembles, Automatic Machine Learning (AutoML), etc.",6875,1993,Jupyter Notebook,2014-03-03,2024-10-02,2841,2014,2024
301,Introduction_to_Machine_Learning,SharifiZarchi,https://github.com/SharifiZarchi/Introduction_to_Machine_Learning,"Machine Learning Course, Sharif University of Technology",1162,208,Jupyter Notebook,2022-09-01,2024-10-02,9,2022,2024
302,machine-learning-notebooks,diegoinacio,https://github.com/diegoinacio/machine-learning-notebooks,???? An authorial set of fundamental python recipes on Machine Learning and Artificial Intelligence.,78,14,Jupyter Notebook,2019-12-06,2024-09-23,7,2019,2024
303,TensorFlow-Machine-Learning-Cookbook,PacktPublishing,https://github.com/PacktPublishing/TensorFlow-Machine-Learning-Cookbook,Code repository for TensorFlow Machine Learning Cookbook by Packt,561,396,Python,2017-02-14,2024-09-13,0,2017,2024
304,Python-Machine-Learning-Algorithm,zhaozhiyong19890102,https://github.com/zhaozhiyong19890102/Python-Machine-Learning-Algorithm,Python-Machine-Learning-Algorithm,391,321,Python,2017-04-26,2024-07-22,7,2017,2024
305,Machine_Learning_Study_Path,linxid,https://github.com/linxid/Machine_Learning_Study_Path,机器学习过程中所看的书，视频和源码,839,232,Python,2018-02-27,2024-09-24,2,2018,2024
306,AISec,sdnewhop,https://github.com/sdnewhop/AISec,Cybersecurity of Machine Learning and Artificial Intelligence ,64,18,JavaScript,2019-08-22,2024-08-22,0,2019,2024
307,interactive-machine-learning-list,stared,https://github.com/stared/interactive-machine-learning-list,"A collaborative list of interactive Machine Learning, Deep Learning and Statistics websites",432,42,JavaScript,2018-05-31,2024-08-30,2,2018,2024
308,kafka-streams-machine-learning-examples,kaiwaehner,https://github.com/kaiwaehner/kafka-streams-machine-learning-examples,"This project contains examples which demonstrate how to deploy analytic models to mission-critical, scalable production environments leveraging Apache Kafka and its Streams API. Models are built with Python, H2O, TensorFlow, Keras, DeepLearning4 and other technologies.",842,305,Java,2017-08-16,2024-09-11,10,2017,2024
309,php-ml,jorgecasas,https://github.com/jorgecasas/php-ml,PHP Machine Learning library,290,1080,PHP,2016-05-05,2024-09-11,0,2016,2024
