id,name,owner,url,description,stars,forks,language,created_at,updated_at,open_issues,create_year,update_year
421,ChatterBot,gunthercox,https://github.com/gunthercox/ChatterBot,"ChatterBot is a machine learning, conversational dialog engine for creating chat bots",14037,4436,Python,2014-09-28,2024-10-02,411,2014,2024
422,Interpretable-Machine-Learning-with-Python,PacktPublishing,https://github.com/PacktPublishing/Interpretable-Machine-Learning-with-Python,"Interpretable Machine Learning with Python, published by Packt",441,192,Jupyter Notebook,2020-06-23,2024-10-02,10,2020,2024
423,elasticsearch-learning-to-rank,o19s,https://github.com/o19s/elasticsearch-learning-to-rank,Plugin to integrate Learning to Rank (aka machine learning for better relevance) with Elasticsearch,1476,370,Java,2016-12-25,2024-09-25,40,2016,2024
424,Machine-Learning-Curriculum,maykulkarni,https://github.com/maykulkarni/Machine-Learning-Curriculum,Complete path for a beginner to become a Machine Learning Scientist!,329,121,Jupyter Notebook,2017-06-20,2024-09-29,1,2017,2024
425,Machine-Learning-Note,lcatro,https://github.com/lcatro/Machine-Learning-Note,机器学习笔记,426,102,Python,2017-11-07,2024-08-12,0,2017,2024
426,DataSciencePython,ujjwalkarn,https://github.com/ujjwalkarn/DataSciencePython,common data analysis and machine learning tasks using python,5239,1496,Python,2015-10-06,2024-10-02,11,2015,2024
427,serving,tensorflow,https://github.com/tensorflow/serving,"A flexible, high-performance serving system for machine learning models",6166,2190,C++,2016-01-26,2024-10-02,107,2016,2024
428,HLearn,mikeizbicki,https://github.com/mikeizbicki/HLearn,Homomorphic machine learning,1625,134,Haskell,2012-07-18,2024-09-04,23,2012,2024
429,Machine-Learning-and-Reinforcement-Learning-in-Finance,joelowj,https://github.com/joelowj/Machine-Learning-and-Reinforcement-Learning-in-Finance,Machine Learning and Reinforcement Learning in Finance New York University Tandon School of Engineering,246,119,Jupyter Notebook,2018-06-26,2024-09-15,6,2018,2024
430,awesome-machine-learning-jupyter-notebooks-for-colab,toxtli,https://github.com/toxtli/awesome-machine-learning-jupyter-notebooks-for-colab,A curated list of Machine Learning and Deep Learning tutorials in Jupyter Notebook format ready to run in Google Colaboratory,284,71,Jupyter Notebook,2019-10-14,2024-09-12,0,2019,2024
431,cn-machine-learning,udacity,https://github.com/udacity/cn-machine-learning,https://cn.udacity.com/mlnd/,130,171,Jupyter Notebook,2017-05-24,2024-07-24,3,2017,2024
432,MachineLearningEx,lawlite19,https://github.com/lawlite19/MachineLearningEx,Coursera上斯坦福大学的机器学习编程作业——Andrew Ng,193,85,MATLAB,2016-09-27,2024-09-25,0,2016,2024
433,ml-basics,MicrosoftDocs,https://github.com/MicrosoftDocs/ml-basics,Exercise notebooks for Machine Learning modules on Microsoft Learn,1757,2263,Jupyter Notebook,2020-06-13,2024-09-27,13,2020,2024
434,DeepLIIF,nadeemlab,https://github.com/nadeemlab/DeepLIIF,"Deep Learning Inferred Multiplex ImmunoFluorescence for IHC Image Quantification (https://deepliif.org) [Nature Machine Intelligence'22, CVPR'22, MICCAI'23, Histopathology'23, MICCAI'24]",166,61,Python,2021-04-15,2024-09-30,1,2021,2024
435,few-shot,oscarknagg,https://github.com/oscarknagg/few-shot,Repository for few-shot learning machine learning projects,1198,245,Python,2018-10-30,2024-10-02,36,2018,2024
436,aerosolve,airbnb,https://github.com/airbnb/aerosolve,A machine learning package built for humans.,4795,563,Scala,2015-05-12,2024-09-30,10,2015,2024
437,math-for-machine-learning,codebasics,https://github.com/codebasics/math-for-machine-learning,Statistics and math for machine learning and data science,110,244,Jupyter Notebook,2021-04-17,2024-09-28,0,2021,2024
438,machine-learning-list,elicit,https://github.com/elicit/machine-learning-list,"A curriculum for learning about foundation models, from scratch to the frontier",939,70,Jupyter Notebook,2024-04-11,2024-09-30,1,2024,2024
439,pycaret,pycaret,https://github.com/pycaret/pycaret,"An open-source, low-code machine learning library in Python",8850,1763,Jupyter Notebook,2019-11-23,2024-10-02,381,2019,2024
440,machine-learning-imbalanced-data,solegalli,https://github.com/solegalli/machine-learning-imbalanced-data,Code repository for the online course Machine Learning with Imbalanced Data,159,211,Jupyter Notebook,2020-10-13,2024-08-29,0,2020,2024
441,linfa,rust-ml,https://github.com/rust-ml/linfa,A Rust machine learning framework.,3693,243,Rust,2018-04-05,2024-10-02,73,2018,2024
442,DeepMachineLearning,interpss,https://github.com/interpss/DeepMachineLearning,,36,21,Java,2017-04-07,2022-01-24,0,2017,2022
443,DeepField,Skoltech-CHR,https://github.com/Skoltech-CHR/DeepField,Machine learning framework for reservoir simulation,113,37,C++,2021-04-26,2024-09-29,0,2021,2024
444,Augmentor,mdbloice,https://github.com/mdbloice/Augmentor,Image augmentation library in Python for machine learning.,5061,866,Python,2016-03-01,2024-09-29,139,2016,2024
445,ML-foundations,jonkrohn,https://github.com/jonkrohn/ML-foundations,"Machine Learning Foundations: Linear Algebra, Calculus, Statistics & Computer Science",3379,1627,Jupyter Notebook,2020-04-18,2024-10-02,0,2020,2024
446,stat479-machine-learning-fs18,rasbt,https://github.com/rasbt/stat479-machine-learning-fs18,Course material for STAT 479: Machine Learning (FS 2018) at University Wisconsin-Madison,489,227,Jupyter Notebook,2018-09-06,2024-09-27,0,2018,2024
447,DeepQLearning,blakeMilner,https://github.com/blakeMilner/DeepQLearning,"A powerful machine learning algorithm utilizing Q-Learning and Neural Networks, implemented using Torch and Lua.",131,59,MoonScript,2014-11-15,2023-11-29,1,2014,2023
448,Complete-Machine-Learning-,Coder-World04,https://github.com/Coder-World04/Complete-Machine-Learning-,This repository contains everything you need to become proficient in Machine Learning,520,88,Jupyter Notebook,2022-04-30,2024-10-02,0,2022,2024
449,introduction_to_ml_with_python,amueller,https://github.com/amueller/introduction_to_ml_with_python,"Notebooks and code for the book ""Introduction to Machine Learning with Python""",7389,4554,Jupyter Notebook,2016-05-29,2024-10-01,24,2016,2024
450,nilearn,nilearn,https://github.com/nilearn/nilearn,Machine learning for NeuroImaging in Python,1170,594,Python,2011-01-09,2024-10-02,288,2011,2024
451,machine-learning-programming-assignments-coursera-andrew-ng,AvaisP,https://github.com/AvaisP/machine-learning-programming-assignments-coursera-andrew-ng,Solutions to Andrew NG's machine learning course on Coursera,389,324,MATLAB,2016-08-20,2024-09-10,8,2016,2024
452,ebookMLCB,tiepvupsu,https://github.com/tiepvupsu/ebookMLCB,ebook Machine Learning cơ bản,1340,351,Jupyter Notebook,2020-01-03,2024-09-29,13,2020,2024
453,alluxio,Alluxio,https://github.com/Alluxio/alluxio,"Alluxio, data orchestration for analytics and machine learning in the cloud",6816,2934,Java,2012-12-21,2024-10-01,1026,2012,2024
454,rusty-machine,AtheMathmo,https://github.com/AtheMathmo/rusty-machine,Machine Learning library for Rust,1252,152,Rust,2015-11-14,2024-09-22,47,2015,2024
455,machine-learning-for-physicists,FlorianMarquardt,https://github.com/FlorianMarquardt/machine-learning-for-physicists,"Code for ""Machine Learning for Physicists"" lecture series by Florian Marquardt",269,157,Jupyter Notebook,2020-06-10,2024-10-02,2,2020,2024
456,flashlight,flashlight,https://github.com/flashlight/flashlight,A C++ standalone library for machine learning,5258,495,C++,2018-12-11,2024-10-02,118,2018,2024
457,Machine-Learning--Projects,Simplilearn-Edu,https://github.com/Simplilearn-Edu/Machine-Learning--Projects,Projects and datasets for Machine Learning,163,139,Jupyter Notebook,2019-04-04,2024-09-23,3,2019,2024
458,Machine-Learning-for-Asset-Managers,emoen,https://github.com/emoen/Machine-Learning-for-Asset-Managers,"Implementation of code snippets, exercises and application to live data from Machine Learning for Asset Managers (Elements in Quantitative Finance) written by Prof. Marcos López de Prado.",474,161,Python,2020-06-21,2024-09-29,8,2020,2024
459,machine-learning-uiuc,Zhenye-Na,https://github.com/Zhenye-Na/machine-learning-uiuc,"????️ CS446: Machine Learning in Spring 2018, University of Illinois at Urbana-Champaign",270,113,Python,2018-01-26,2024-10-01,1,2018,2024
460,the-math-of-intelligence,LearnMachineLearning,https://github.com/LearnMachineLearning/the-math-of-intelligence,List of resources & possible pathway for the Math of Machine Learning and AI.,404,46,Jupyter Notebook,2018-03-18,2024-08-18,0,2018,2024
461,machine-learning-models,RiadKatby,https://github.com/RiadKatby/machine-learning-models,An attempt to spread knowledge about machine learning and artificial intelligence to everyone using the Arabic language.,69,10,Jupyter Notebook,2022-03-02,2024-09-07,0,2022,2024
462,Machine-learning-in-action,TingNie,https://github.com/TingNie/Machine-learning-in-action,个人使用jupyter notebook整理的peter的《机器学习实战》代码，使其更有层次感，更加连贯，也加了一些自己的修改，以及注释,296,144,Jupyter Notebook,2017-11-17,2024-09-18,0,2017,2024
463,m1-machine-learning-test,mrdbourke,https://github.com/mrdbourke/m1-machine-learning-test,Code for testing various M1 Chip benchmarks with TensorFlow.,523,152,Jupyter Notebook,2021-11-14,2024-10-02,10,2021,2024
464,100DaysofMLCode,NishkarshRaj,https://github.com/NishkarshRaj/100DaysofMLCode,My journey to learn and grow in the domain of Machine Learning and Artificial Intelligence by performing the #100DaysofMLCode Challenge. Now supported by bright developers adding their learnings :+1:,322,163,Jupyter Notebook,2020-01-11,2024-09-24,34,2020,2024
465,Coursera-Machine-Learning-Specialization,quocviethere,https://github.com/quocviethere/Coursera-Machine-Learning-Specialization,2022 Coursera Machine Learning Specialization Optional Labs and Programming Assignments,232,157,Jupyter Notebook,2021-12-24,2024-09-23,2,2021,2024
466,awesome-machine-learning-python,ugwaj,https://github.com/ugwaj/awesome-machine-learning-python,Machine and Deep Learning in Python,6,90,Jupyter Notebook,2015-07-15,2020-05-17,0,2015,2020
467,oreilly_machine_learning_from_scratch,thomasnield,https://github.com/thomasnield/oreilly_machine_learning_from_scratch,"Resources for the O'Reilly Online Training ""Machine Learning from Scratch"" ",240,206,Python,2019-06-01,2024-09-20,0,2019,2024
468,teachable-machine-v1,googlecreativelab,https://github.com/googlecreativelab/teachable-machine-v1," Explore how machine learning works, live in the browser. No coding required.",3849,599,JavaScript,2017-10-03,2024-09-29,18,2017,2024
469,Neural-Net-with-Financial-Time-Series-Data,BenjiKCF,https://github.com/BenjiKCF/Neural-Net-with-Financial-Time-Series-Data,"This solution presents an accessible, non-trivial example of machine learning (Deep learning) with financial time series using TensorFlow",753,312,Jupyter Notebook,2017-03-22,2024-09-13,6,2017,2024
470,awesome_ML_AI_RSS_feed,vishalshar,https://github.com/vishalshar/awesome_ML_AI_RSS_feed,"Awesome curated RSS feed links related to Machine Learning, Artificial Intelligence, Reinforcement Learning",160,13,Jupyter Notebook,2020-07-26,2024-09-17,1,2020,2024
471,MLfromscratch,patrickloeber,https://github.com/patrickloeber/MLfromscratch,Machine Learning algorithm implementations from scratch.,1278,526,Python,2019-05-31,2024-10-01,10,2019,2024
472,Awesome-Mobile-Machine-Learning,mitutitu16,https://github.com/mitutitu16/Awesome-Mobile-Machine-Learning,A curated list of awesome mobile machine learning resources.,117,207,Jupyter Notebook,2019-04-16,2024-09-26,0,2019,2024
473,Deep_Learning_in_Python_2018,snrazavi,https://github.com/snrazavi/Deep_Learning_in_Python_2018,"Deep Learning workshop including image classification, face recognition, Object detection, language modelling, image captioning and neural machine translation.",131,58,Jupyter Notebook,2018-10-16,2024-09-30,1,2018,2024
474,machine-learning-in-computer-vision,mheriyanto,https://github.com/mheriyanto/machine-learning-in-computer-vision,:memo: References list for machine learning and deep learning in computer vision.,111,43,TeX,2019-06-01,2024-10-02,3,2019,2024
475,monetizing-machine-learning,Apress,https://github.com/Apress/monetizing-machine-learning,Source code for 'Monetizing Machine Learning' by Manuel Amunategui and Mehdi Roopaei ,136,141,Jupyter Notebook,2018-08-02,2023-09-26,2,2018,2023
476,Machine-Learning-for-Cybersecurity-Cookbook,PacktPublishing,https://github.com/PacktPublishing/Machine-Learning-for-Cybersecurity-Cookbook,"Machine Learning for Cybersecurity Cookbook, published by Packt",308,180,Jupyter Notebook,2019-11-18,2024-09-30,12,2019,2024
477,Feature-Selection-for-Machine-Learning,anujdutt9,https://github.com/anujdutt9/Feature-Selection-for-Machine-Learning,Methods with examples for Feature Selection during Pre-processing in Machine Learning.,364,163,Jupyter Notebook,2018-06-02,2024-09-07,0,2018,2024
478,MLwR,dataspelunking,https://github.com/dataspelunking/MLwR,Machine Learning with R,226,420,R,2014-12-07,2024-09-12,1,2014,2024
479,Category_Theory_Machine_Learning,bgavran,https://github.com/bgavran/Category_Theory_Machine_Learning,List of papers studying machine learning through the lens of category theory,1262,70,Python,2020-07-09,2024-09-28,1,2020,2024
480,machine-learning-andrew-ng,susilvaalmeida,https://github.com/susilvaalmeida/machine-learning-andrew-ng,Implementations in python of methods and programming assignments of course Machine Learning of Coursera by Andrew Ng,275,137,Jupyter Notebook,2019-03-15,2024-09-30,0,2019,2024
481,python-ml-course,joanby,https://github.com/joanby/python-ml-course,Curso de Introducción a Machine Learning con Python,768,1538,Jupyter Notebook,2018-03-20,2024-09-21,3,2018,2024
482,search_with_machine_learning_course,gsingers,https://github.com/gsingers/search_with_machine_learning_course,Public repository for the Search with Machine Learning course taught by Daniel Tunkelang and Grant Ingersoll.  Available at https://corise.com/course/search-with-machine-learning?utm_source=daniel.,51,375,Python,2021-12-06,2024-08-05,4,2021,2024
483,PyTorch_Machine_Learning,tirthajyoti,https://github.com/tirthajyoti/PyTorch_Machine_Learning,"Machine learning, Deep Learning, CNN with PyTorch",80,30,Jupyter Notebook,2019-03-17,2024-04-06,0,2019,2024
484,hadron-collider-machine-learning,hse-aml,https://github.com/hse-aml/hadron-collider-machine-learning,"Materials for ""Addressing Large Hadron Collider Challenges by Machine Learning"" Coursera MOOC",94,213,Jupyter Notebook,2018-05-30,2024-04-05,2,2018,2024
485,teachablemachine-community,googlecreativelab,https://github.com/googlecreativelab/teachablemachine-community,Example code snippets and machine learning code for Teachable Machine,1500,669,TypeScript,2019-06-17,2024-10-01,199,2019,2024
486,CrackingMachineLearningInterview,shafaypro,https://github.com/shafaypro/CrackingMachineLearningInterview,"A repository to prepare you for your machine learning interview, involving most of the questions asked by all the tech giants and local companies. Do this to Ace your Machine Learning Engineer Interviews",431,111,Jupyter Notebook,2020-05-23,2024-09-30,1,2020,2024
487,pyprobml,probml,https://github.com/probml/pyprobml,"Python code for ""Probabilistic Machine learning"" book by Kevin Murphy",6479,1522,Jupyter Notebook,2016-08-17,2024-10-02,32,2016,2024
488,mlcourse,davidrosenberg,https://github.com/davidrosenberg/mlcourse,Machine learning course materials.,568,268,Jupyter Notebook,2015-10-11,2024-09-29,36,2015,2024
489,Algorithmic_Trading_Machine_Learning,Luchkata,https://github.com/Luchkata/Algorithmic_Trading_Machine_Learning,,228,145,Jupyter Notebook,2023-10-13,2024-09-29,4,2023,2024
490,DeepLearning_MachineLearning_Q.A.,taoyafan,https://github.com/taoyafan/DeepLearning_MachineLearning_Q.A.,根据别人和自己在机器学习岗、深度学习岗的面试问题以及答案总结,34,15,Jupyter Notebook,2019-03-09,2024-07-27,0,2019,2024
491,turicreate,apple,https://github.com/apple/turicreate,Turi Create simplifies the development of custom machine learning models.,11191,1138,C++,2017-12-01,2024-10-01,523,2017,2024
492,DeepDataMiningLearning,lkk688,https://github.com/lkk688/DeepDataMiningLearning,"Data mining, machine learning, and deep learning sample code",21,46,Jupyter Notebook,2021-08-31,2024-10-02,0,2021,2024
493,machine-learning-specialization-andrew-ng,pmulard,https://github.com/pmulard/machine-learning-specialization-andrew-ng,A collection of notes and implementations of machine learning algorithms from Andrew Ng's machine learning specialization.,563,126,Jupyter Notebook,2023-04-01,2024-10-02,0,2023,2024
494,best-of-ml-python,ml-tooling,https://github.com/ml-tooling/best-of-ml-python,???? A ranked list of awesome machine learning Python libraries. Updated weekly.,16300,2358,Jupyter Notebook,2020-11-29,2024-10-02,27,2020,2024
495,machine_learning_project,avnyadav,https://github.com/avnyadav/machine_learning_project,This is first machine learning project. ,60,185,Jupyter Notebook,2022-06-11,2024-08-03,3,2022,2024
496,stat451-machine-learning-fs20,rasbt,https://github.com/rasbt/stat451-machine-learning-fs20,STAT 451: Intro to Machine Learning @ UW-Madison (Fall 2020),384,198,Jupyter Notebook,2020-08-06,2024-10-02,0,2020,2024
497,Mastering-Machine-Learning-for-Penetration-Testing,PacktPublishing,https://github.com/PacktPublishing/Mastering-Machine-Learning-for-Penetration-Testing,"Mastering Machine Learning for Penetration Testing, published by Packt",356,205,Python,2018-04-27,2024-09-28,2,2018,2024
498,Machine-Learning-For-Finance,anthonyng2,https://github.com/anthonyng2/Machine-Learning-For-Finance,Machine Learning for finance and investment introduction,249,132,Jupyter Notebook,2017-07-11,2024-08-11,0,2017,2024
499,Coursera-ML,DragonflyStats,https://github.com/DragonflyStats/Coursera-ML,Machine Learning with Coursera,384,306,TeX,2013-10-20,2024-10-02,2,2013,2024
500,Machine-Learning-for-Beginner-by-Python3,Anfany,https://github.com/Anfany/Machine-Learning-for-Beginner-by-Python3,为机器学习的入门者提供多种基于实例的sklearn、TensorFlow以及自编函数(AnFany)的ML算法程序。,426,249,Python,2018-03-09,2024-09-06,3,2018,2024
501,AndrewNgMachineLearning,xjwhhh,https://github.com/xjwhhh/AndrewNgMachineLearning,,279,125,MATLAB,2018-05-26,2024-08-31,1,2018,2024
502,fklearn,nubank,https://github.com/nubank/fklearn,fklearn: Functional Machine Learning,1507,164,Jupyter Notebook,2019-02-27,2024-09-30,40,2019,2024
503,shap,shap,https://github.com/shap/shap,A game theoretic approach to explain the output of any machine learning model.,22605,3258,Jupyter Notebook,2016-11-22,2024-10-02,787,2016,2024
504,TensorFlow-ML-Exercises,golbin,https://github.com/golbin/TensorFlow-ML-Exercises,Learning Machine Learning with TensorFlow,263,145,Python,2016-12-22,2024-07-26,0,2016,2024
505,FINDER,FFrankyy,https://github.com/FFrankyy/FINDER,FINDER - FInding key players in complex Networks through DEep Reinforcement learning (Nature Machine Intelligence),177,46,Python,2020-03-08,2024-09-26,15,2020,2024
506,python_data_science_and_machine_learning_bootcamp,ccniuj,https://github.com/ccniuj/python_data_science_and_machine_learning_bootcamp,Jupyter notebook for Udemy course: Python data science and machine learning bootcamp,217,327,Jupyter Notebook,2017-01-15,2024-07-02,0,2017,2024
507,Udacity-Machine-Learning-Nanodegree,dsoellinger,https://github.com/dsoellinger/Udacity-Machine-Learning-Nanodegree,All projects and lecture notes of the Udacity Machine Learning Engineer Nanodegree.,213,138,Jupyter Notebook,2018-03-14,2024-08-23,0,2018,2024
508,MachineLearningFAQ,nxpeng9235,https://github.com/nxpeng9235/MachineLearningFAQ,Machine Learning FAQ,251,59,Jupyter Notebook,2021-03-18,2024-09-28,0,2021,2024
509,Machine_Learning_2018,snrazavi,https://github.com/snrazavi/Machine_Learning_2018,"Codes and Project for Machine Learning Course, Fall 2018, University of Tabriz",208,105,Jupyter Notebook,2018-10-16,2024-09-25,2,2018,2024
510,coursera,knazeri,https://github.com/knazeri/coursera,Coursera's  Machine/Deep Learning assignments,49,93,Jupyter Notebook,2018-04-22,2024-08-29,1,2018,2024
511,CleverAlgorithmsMachineLearning,clever-algorithms,https://github.com/clever-algorithms/CleverAlgorithmsMachineLearning,Defunct,240,130,Jupyter Notebook,2011-02-07,2024-08-24,2,2011,2024
512,AForge.NET,andrewkirillov,https://github.com/andrewkirillov/AForge.NET,"AForge.NET Framework is a C# framework designed for developers and researchers in the fields of Computer Vision and Artificial Intelligence - image processing, neural networks, genetic algorithms, machine learning, robotics, etc. ",1090,492,C#,2014-11-24,2024-09-30,45,2014,2024
513,quantum,tensorflow,https://github.com/tensorflow/quantum,Hybrid Quantum-Classical Machine Learning in TensorFlow,1788,572,Python,2020-02-06,2024-10-01,151,2020,2024
514,learning-deep,timdavidlee,https://github.com/timdavidlee/learning-deep,"All my deep learning notes: contains v1 of machine learning with Jeremy Howard, and v1 of Fastai Deep Learning 2018  part 1",67,41,Jupyter Notebook,2017-10-23,2023-12-10,1,2017,2023
515,Data-Science-and-Machine-Learning-from-Scratch,hammadshaikhha,https://github.com/hammadshaikhha/Data-Science-and-Machine-Learning-from-Scratch,Implements common data science methods and machine learning algorithms from scratch in python. Intuition and theory behind the algorithms is also discussed.,430,234,Jupyter Notebook,2017-06-28,2024-08-26,2,2017,2024
516,fraud-detection-using-machine-learning,aws-solutions-library-samples,https://github.com/aws-solutions-library-samples/fraud-detection-using-machine-learning,Setup end to end demo architecture for predicting fraud events with Machine Learning using Amazon SageMaker,293,154,Jupyter Notebook,2019-05-17,2024-10-02,5,2019,2024
517,awesome-multimodal-ml,pliang279,https://github.com/pliang279/awesome-multimodal-ml,Reading list for research topics in multimodal machine learning,5925,849,Jupyter Notebook,2019-05-27,2024-10-02,7,2019,2024
518,awesome-machine-learning-resources,ZhiningLiu1998,https://github.com/ZhiningLiu1998/awesome-machine-learning-resources,???? A curated list of awesome lists across all machine learning topics. | 机器学习/深度学习/人工智能一切主题 (学习范式/任务/应用/模型/道德/交叉学科/数据集/框架/教程) 的资源列表汇总。,536,87,Jupyter Notebook,2021-12-21,2024-09-29,0,2021,2024
519,Machine-Learning-Knowledge,Pysamlam,https://github.com/Pysamlam/Machine-Learning-Knowledge,"???? Important machine learning knowledge, each article deeply analyzes theoretical knowledge",118,24,Jupyter Notebook,2020-02-07,2024-09-04,0,2020,2024
520,deep-machine-learning,JulianoLagana,https://github.com/JulianoLagana/deep-machine-learning,Repository for SSY340 - Deep Machine Learning,13,38,Jupyter Notebook,2017-08-22,2024-02-28,0,2017,2024
521,time-series-machine-learning,maxim5,https://github.com/maxim5/time-series-machine-learning,Machine learning models for time series analysis,369,103,Python,2017-06-08,2024-09-19,14,2017,2024
522,machine-learning-python-template,4GeeksAcademy,https://github.com/4GeeksAcademy/machine-learning-python-template,Very simple template to work on machine learning projects with Python,5,687,Jupyter Notebook,2022-06-15,2024-08-19,43,2022,2024
523,MachineLearning-WatermelonBook,Relph1119,https://github.com/Relph1119/MachineLearning-WatermelonBook,周志华-机器学习,260,66,Jupyter Notebook,2019-03-27,2024-09-19,0,2019,2024
524,awesome-mlss,awesome-mlss,https://github.com/awesome-mlss/awesome-mlss,???? Machine Learning Summer School deadlines,2649,296,HTML,2018-12-01,2024-10-02,17,2018,2024
525,machine-learning-collection,microsoft,https://github.com/microsoft/machine-learning-collection,:closed_book:machine learning tech collections at Microsoft and subsidiaries.,421,71,Jupyter Notebook,2021-01-26,2024-10-01,2,2021,2024
526,Books-Machine-Learning-and-data-Science,Premalatha-success,https://github.com/Premalatha-success/Books-Machine-Learning-and-data-Science,,36,506,Jupyter Notebook,2022-05-27,2024-09-30,0,2022,2024
527,Machine_Learning_Algorithms_from_Scratch,milaan9,https://github.com/milaan9/Machine_Learning_Algorithms_from_Scratch,This repository explores the variety of techniques and algorithms commonly used in machine learning and the implementation in MATLAB and PYTHON.,185,178,Jupyter Notebook,2020-09-09,2024-07-29,1,2020,2024
528,visual-machine-learning-notes,visual-ml-notes,https://github.com/visual-ml-notes/visual-machine-learning-notes,Machine Learning Conference & Summer School Notes.  ????,571,82,Jupyter Notebook,2019-09-23,2024-08-13,0,2019,2024
529,ml-class,lukas,https://github.com/lukas/ml-class,Machine learning lessons and teaching projects designed for engineers,2353,1167,Jupyter Notebook,2015-09-01,2024-10-02,13,2015,2024
530,Jupyter,TheAlgorithms,https://github.com/TheAlgorithms/Jupyter,"The repository contains script and notebook related to Statistics, Machine learning, Neural network, Deep learning, NLP, Numerical methods, and Automation. ",784,300,Jupyter Notebook,2019-10-08,2024-09-30,20,2019,2024
531,clubber.ml,BUPT,https://github.com/BUPT/clubber.ml,"A.M.C. - Artificial Intelligence & Machine Learning CLUB: Friends for Code, Paper, and Beers!???? ",120,37,Python,2018-07-16,2024-07-31,138,2018,2024
532,hls4ml,fastmachinelearning,https://github.com/fastmachinelearning/hls4ml,Machine learning on FPGAs using HLS,1241,402,C++,2017-10-25,2024-10-02,173,2017,2024
533,MITx_6.86x,sylvaticus,https://github.com/sylvaticus/MITx_6.86x,Notes of MITx 6.86x - Machine Learning with Python: from Linear Models to Deep Learning,297,138,HTML,2020-03-03,2024-09-24,0,2020,2024
