id,name,owner,url,description,stars,forks,language,created_at,updated_at,open_issues,create_year,update_year
1,Artificial-Intelligence-Deep-Learning-Machine-Learning-Tutorials,TarrySingh,https://github.com/TarrySingh/Artificial-Intelligence-Deep-Learning-Machine-Learning-Tutorials,"A comprehensive list of Deep Learning / Artificial Intelligence and Machine Learning tutorials - rapidly expanding into areas of AI/Deep Learning / Machine Vision / NLP and industry specific areas such as Climate / Energy, Automotives, Retail, Pharma, Medicine, Healthcare, Policy, Ethics and more.",3737,1618,Python,2017-07-13,2024-10-01,156,2017,2024
2,MachineLearning,wepe,https://github.com/wepe/MachineLearning,Basic Machine Learning and Deep Learning,5188,3173,Python,2014-12-05,2024-10-02,42,2014,2024
3,Artificial-Intelligence-and-Machine-Learning,emilmont,https://github.com/emilmont/Artificial-Intelligence-and-Machine-Learning,Algorithm implementations and homework solutions for the Stanford's online courses,545,309,Python,2011-10-16,2024-09-16,0,2011,2024
4,Machine-Learning-Tutorials,ujjwalkarn,https://github.com/ujjwalkarn/Machine-Learning-Tutorials,"machine learning and deep learning tutorials, articles and other resources ",15420,3787,Jupyter Notebook,2015-09-12,2024-10-02,40,2015,2024
5,DL-Notes-for-Interview,vivienzou1,https://github.com/vivienzou1/DL-Notes-for-Interview,deep learning/ machine learning,346,8071,Jupyter Notebook,2018-06-09,2024-09-25,4,2018,2024
6,Machine-Learning-Collection,aladdinpersson,https://github.com/aladdinpersson/Machine-Learning-Collection,A resource for learning about Machine learning & Deep Learning,7516,2681,Python,2020-03-26,2024-10-02,108,2020,2024
7,cheatsheet-translation,shervinea,https://github.com/shervinea/cheatsheet-translation,"Translation of VIP cheatsheets for Machine Learning Deep Learning, and Artificial Intelligence",889,332,Jupyter Notebook,2018-09-13,2024-09-08,41,2018,2024
8,500-AI-Machine-learning-Deep-learning-Computer-vision-NLP-Projects-with-code,ashishpatel26,https://github.com/ashishpatel26/500-AI-Machine-learning-Deep-learning-Computer-vision-NLP-Projects-with-code,500 AI Machine learning Deep learning Computer vision NLP Projects with code,19830,5065,Jupyter Notebook,2021-01-02,2024-10-02,41,2021,2024
9,machinelearning,gianlucamalato,https://github.com/gianlucamalato/machinelearning,Machine learning and artificial intelligence,297,237,Jupyter Notebook,2020-02-28,2024-07-18,0,2020,2024
10,artificial-intelligence-and-machine-learning,yacineMahdid,https://github.com/yacineMahdid/artificial-intelligence-and-machine-learning,A repository for implementation of artificial intelligence algorithm which includes machine learning and deep learning algorithm as well as classical AI search algorithm,162,92,Jupyter Notebook,2018-11-20,2024-09-13,16,2018,2024
11,MachineLearningNotebooks,Azure,https://github.com/Azure/MachineLearningNotebooks,Python notebooks with ML and deep learning examples with Azure Machine Learning Python SDK | Microsoft,4073,2517,Jupyter Notebook,2018-08-17,2024-10-02,391,2018,2024
12,deep-learning-drizzle,kmario23,https://github.com/kmario23/deep-learning-drizzle,"Drench yourself in Deep Learning, Reinforcement Learning, Machine Learning, Computer Vision, and NLP by learning from these exciting lectures!!",12146,2917,HTML,2018-11-26,2024-10-02,6,2018,2024
13,awesome-machine-learning,josephmisiti,https://github.com/josephmisiti/awesome-machine-learning,"A curated list of awesome Machine Learning frameworks, libraries and software.",65553,14592,Python,2014-07-15,2024-10-02,5,2014,2024
14,DeepLearningProject,Spandan-Madan,https://github.com/Spandan-Madan/DeepLearningProject,An in-depth machine learning tutorial introducing readers to a whole machine learning pipeline from scratch.,4754,638,HTML,2017-07-12,2024-10-01,6,2017,2024
15,start-machine-learning,louisfb01,https://github.com/louisfb01/start-machine-learning,"A complete guide to start and improve in machine learning (ML), artificial intelligence (AI) in 2024 without ANY background in the field and stay up-to-date with the latest news and state-of-the-art techniques!",4415,575,Jupyter Notebook,2020-09-24,2024-10-02,2,2020,2024
16,smile,haifengl,https://github.com/haifengl/smile,Statistical Machine Intelligence & Learning Engine,6017,1125,Java,2014-11-20,2024-10-02,9,2014,2024
17,notes,brylevkirill,https://github.com/brylevkirill/notes,Learn about Machine Learning and Artificial Intelligence,916,237,Jupyter Notebook,2016-04-22,2024-09-27,1,2016,2024
18,Qix,ty4z2008,https://github.com/ty4z2008/Qix,Machine Learning、Deep Learning、PostgreSQL、Distributed System、Node.Js、Golang,14684,4657,Jupyter Notebook,2014-04-20,2024-10-02,2,2014,2024
19,machine-learning-mindmap,dformoso,https://github.com/dformoso/machine-learning-mindmap,"A mindmap summarising Machine Learning concepts, from Data Analysis to Deep Learning.",6111,1004,Jupyter Notebook,2017-08-10,2024-10-02,4,2017,2024
20,netron,lutzroeder,https://github.com/lutzroeder/netron,"Visualizer for neural network, deep learning and machine learning models",27745,2756,JavaScript,2010-12-26,2024-10-02,24,2010,2024
21,artificial-intelligence-foundations-machine-learning-3067770,LinkedInLearning,https://github.com/LinkedInLearning/artificial-intelligence-foundations-machine-learning-3067770,This is a repo for the LinkedIn Learning course Artificial Intelligence Foundations: Machine Learning,88,132,Jupyter Notebook,2022-05-17,2024-09-13,1,2022,2024
22,cheatsheets-ai,kailashahirwar,https://github.com/kailashahirwar/cheatsheets-ai,Essential Cheat Sheets for deep learning and machine learning researchers https://medium.com/@kailashahirwar/essential-cheat-sheets-for-machine-learning-and-deep-learning-researchers-efb6a8ebd2e5,15085,3442,Jupyter Notebook,2017-05-24,2024-10-01,9,2017,2024
23,mit-deep-learning-book-pdf,janishar,https://github.com/janishar/mit-deep-learning-book-pdf,"MIT Deep Learning Book in PDF format (complete and parts) by Ian Goodfellow, Yoshua Bengio and Aaron Courville",12772,2698,Java,2017-04-07,2024-10-02,12,2017,2024
24,Machine-Learning,Jack-Cherish,https://github.com/Jack-Cherish/Machine-Learning,:zap:机器学习实战（Python3）：kNN、决策树、贝叶斯、逻辑回归、SVM、线性回归、树回归,8997,5068,Python,2017-03-25,2024-10-02,5,2017,2024
25,Deep_Learning_Machine_Learning_Stock,LastAncientOne,https://github.com/LastAncientOne/Deep_Learning_Machine_Learning_Stock,Deep Learning and Machine Learning stocks represent promising opportunities for both long-term and short-term investors and traders.,1225,314,Jupyter Notebook,2018-09-29,2024-10-01,4,2018,2024
26,machine-learning,udacity,https://github.com/udacity/machine-learning,Content for Udacity's Machine Learning curriculum,3930,6347,Jupyter Notebook,2016-01-26,2024-10-02,0,2016,2024
27,machine-learning-notes,roboticcam,https://github.com/roboticcam/machine-learning-notes,"My continuously updated Machine Learning, Probabilistic Models and Deep Learning notes and demos (2000+ slides)  我不间断更新的机器学习，概率模型和深度学习的讲义(2000+页)和视频链接",8383,1716,Jupyter Notebook,2018-02-15,2024-10-01,24,2018,2024
28,mlforhealthlabpub,vanderschaarlab,https://github.com/vanderschaarlab/mlforhealthlabpub,Machine Learning and Artificial Intelligence for Medicine. ,421,170,Python,2020-10-22,2024-09-30,8,2020,2024
29,Introduction-to-Artificial-Intelligence-Machine-Learning,aailabkaist,https://github.com/aailabkaist/Introduction-to-Artificial-Intelligence-Machine-Learning,Apache 2.0 License,145,72,Jupyter Notebook,2016-08-03,2024-08-13,0,2016,2024
30,ai-resources,memo,https://github.com/memo/ai-resources,Selection of resources to learn Artificial Intelligence / Machine Learning / Statistical Inference / Deep Learning / Reinforcement Learning,621,98,Jupyter Notebook,2016-06-04,2024-09-16,3,2016,2024
31,homemade-machine-learning,trekhleb,https://github.com/trekhleb/homemade-machine-learning,???? Python examples of popular machine learning algorithms with interactive Jupyter demos and math being explained,22984,4055,Jupyter Notebook,2018-11-01,2024-10-02,24,2018,2024
32,machine_learning_examples,lazyprogrammer,https://github.com/lazyprogrammer/machine_learning_examples,A collection of machine learning examples and tutorials.,8320,6331,Python,2014-07-31,2024-10-02,40,2014,2024
33,machine-learning-deep-learning-notes,loveunk,https://github.com/loveunk/machine-learning-deep-learning-notes,机器学习、深度学习的学习路径及知识总结,1317,262,Jupyter Notebook,2019-01-31,2024-10-02,0,2019,2024
34,artificial_intelligence,Flowx08,https://github.com/Flowx08/artificial_intelligence,My C++ deep learning framework & other machine learning algorithms,78,26,C++,2018-02-21,2024-09-22,0,2018,2024
35,AI-resources,kashyap32,https://github.com/kashyap32/AI-resources,Selection of resources to learn Artificial Intelligence / Machine Learning / Deep Learning ,220,78,Jupyter Notebook,2017-06-05,2024-07-22,0,2017,2024
36,MachineLearning_Python,lawlite19,https://github.com/lawlite19/MachineLearning_Python,机器学习算法python实现,7154,2428,Python,2016-10-17,2024-10-02,12,2016,2024
37,Machine-learning-learning-notes,Vay-keen,https://github.com/Vay-keen/Machine-learning-learning-notes,周志华《机器学习》又称西瓜书是一本较为全面的书籍，书中详细介绍了机器学习领域不同类型的算法(例如：监督学习、无监督学习、半监督学习、强化学习、集成降维、特征选择等)，记录了本人在学习过程中的理解思路与扩展知识点，希望对新人阅读西瓜书有所帮助！,7265,1869,Jupyter Notebook,2018-03-24,2024-10-02,27,2018,2024
38,ai_notes,frnsys,https://github.com/frnsys/ai_notes,machine learning/artificial intelligence notes,320,74,Jupyter Notebook,2015-09-02,2024-09-14,1,2015,2024
39,deepxde,lululxvi,https://github.com/lululxvi/deepxde,A library for scientific machine learning and physics-informed learning,2635,739,Python,2019-02-08,2024-10-02,248,2019,2024
40,machine-learning-for-software-engineers,ZuzooVn,https://github.com/ZuzooVn/machine-learning-for-software-engineers,A complete daily plan for studying to become a machine learning engineer.,28083,6196,Jupyter Notebook,2016-10-09,2024-10-01,26,2016,2024
41,coursera-deep-learning-specialization,amanchadha,https://github.com/amanchadha/coursera-deep-learning-specialization,"Notes, programming assignments and quizzes from all courses within the Coursera Deep Learning specialization offered by deeplearning.ai: (i) Neural Networks and Deep Learning; (ii) Improving Deep Neural Networks: Hyperparameter tuning, Regularization and Optimization; (iii) Structuring Machine Learning Projects; (iv) Convolutional Neural Networks; (v) Sequence Models",3058,2233,Jupyter Notebook,2020-06-24,2024-10-02,26,2020,2024
42,python-machine-learning-book,rasbt,https://github.com/rasbt/python-machine-learning-book,"The ""Python Machine Learning (1st edition)""  book code repository and info resource",12237,4403,Jupyter Notebook,2015-08-07,2024-10-02,13,2015,2024
43,machine-learning-for-trading,stefan-jansen,https://github.com/stefan-jansen/machine-learning-for-trading,"Code for Machine Learning for Algorithmic Trading, 2nd edition.",13061,4143,Jupyter Notebook,2018-05-09,2024-10-02,2,2018,2024
44,machineLearningDeepLearning,wolfparticle,https://github.com/wolfparticle/machineLearningDeepLearning,李宏毅2021机器学习深度学习笔记PPT作业,530,117,Jupyter Notebook,2021-03-02,2024-10-02,0,2021,2024
45,300Days__MachineLearningDeepLearning,ThinamXx,https://github.com/ThinamXx/300Days__MachineLearningDeepLearning,I am sharing my Journey of 300DaysOfData in Machine Learning and Deep Learning.,539,166,Jupyter Notebook,2020-11-10,2024-09-24,0,2020,2024
46,AI_Books,aridiosilva,https://github.com/aridiosilva/AI_Books,"Books related to  Artificial Intelligence, Machine Learning, Deep Learning and Neural Networks",168,75,Jupyter Notebook,2019-02-20,2024-09-29,0,2019,2024
47,practical-machine-learning-with-python,dipanjanS,https://github.com/dipanjanS/practical-machine-learning-with-python,Master the essential skills needed to recognize and solve complex real-world problems with Machine Learning and Deep Learning by leveraging the highly popular Python Machine Learning Eco-system.,2261,1644,Jupyter Notebook,2017-07-29,2024-09-29,18,2017,2024
48,Learning-Deep-Learning,patrick-llgc,https://github.com/patrick-llgc/Learning-Deep-Learning,Paper reading notes on Deep Learning and Machine Learning,1105,175,Jupyter Notebook,2017-04-02,2024-10-02,1,2017,2024
49,Machine-Learning-with-Python,susanli2016,https://github.com/susanli2016/Machine-Learning-with-Python,Python code for common Machine Learning Algorithms,4306,4819,Jupyter Notebook,2017-05-26,2024-09-30,50,2017,2024
50,machine-learning-zoomcamp,DataTalksClub,https://github.com/DataTalksClub/machine-learning-zoomcamp,Learn ML engineering for free in 4 months!,9370,2192,Jupyter Notebook,2020-04-17,2024-10-02,2,2020,2024
51,stanford-cs-229-machine-learning,afshinea,https://github.com/afshinea/stanford-cs-229-machine-learning,VIP cheatsheets for Stanford's CS 229 Machine Learning,17549,3944,Jupyter Notebook,2018-08-04,2024-10-02,18,2018,2024
52,MachineLearning-DeepLearning-Code-for-my-YouTube-Channel,rohan-paul,https://github.com/rohan-paul/MachineLearning-DeepLearning-Code-for-my-YouTube-Channel,The full collection of all codes for my Youtube Channel segregated as per topic.,392,196,Jupyter Notebook,2020-08-08,2024-09-25,4,2020,2024
53,Introduction-to-TensorFlow-for-Artificial-Intelligence-Machine-Learning-and-Deep-Learning-Coursera,prabh-me,https://github.com/prabh-me/Introduction-to-TensorFlow-for-Artificial-Intelligence-Machine-Learning-and-Deep-Learning-Coursera,"This repository contains the assignments for the Coursera course Introduction to TensorFlow for Artificial Intelligence, Machine Learning, and Deep Learning.",47,46,Jupyter Notebook,2019-08-26,2024-08-27,2,2019,2024
54,tensorflow,tensorflow,https://github.com/tensorflow/tensorflow,An Open Source Machine Learning Framework for Everyone,185793,74221,C++,2015-11-07,2024-10-02,5075,2015,2024
55,awesome-production-machine-learning,EthicalML,https://github.com/EthicalML/awesome-production-machine-learning,"A curated list of awesome open source libraries to deploy, monitor, version and scale your machine learning",17401,2227,Jupyter Notebook,2018-08-15,2024-10-02,7,2018,2024
56,scikit-learn,scikit-learn,https://github.com/scikit-learn/scikit-learn,scikit-learn: machine learning in Python,59623,25306,Python,2010-08-17,2024-10-02,2122,2010,2024
57,Automatic-Trading-using-Artificial-Intelligence-machine-Learning-on-Indian-Stock-Market-_Zerodha,ethics,https://github.com/ethics/Automatic-Trading-using-Artificial-Intelligence-machine-Learning-on-Indian-Stock-Market-_Zerodha,Online trading using Artificial Intelligence Machine leaning with python on Indian Stock Market,63,191,Jupyter Notebook,2019-08-22,2024-08-17,0,2019,2024
58,deploying-machine-learning-models,trainindata,https://github.com/trainindata/deploying-machine-learning-models,"Code for the online course ""Deployment of Machine Learning Models""",792,7710,Jupyter Notebook,2019-01-09,2024-10-01,511,2019,2024
59,awesome-ai-ml-dl,neomatrix369,https://github.com/neomatrix369/awesome-ai-ml-dl,"Awesome Artificial Intelligence, Machine Learning and Deep Learning as we learn it. Study notes and a curated list of awesome resources of such topics.",1472,352,Jupyter Notebook,2018-12-23,2024-09-29,6,2018,2024
60,Deep_and_Machine_Learning_Projects,nitinkaushik01,https://github.com/nitinkaushik01/Deep_and_Machine_Learning_Projects,This Repository contains the list of various Machine and Deep Learning related projects. Related code and data files are available inside this folder. One can go through these projects to implement them in real life for specific use cases.,540,372,Jupyter Notebook,2019-06-21,2024-10-02,12,2019,2024
61,machine-learning-interview,khangich,https://github.com/khangich/machine-learning-interview,"Machine Learning Interviews from FAANG, Snapchat, LinkedIn. I have offers from Snapchat, Coupang, Stitchfix etc. Blog: mlengineer.io.",9100,1492,Jupyter Notebook,2020-08-11,2024-10-02,3,2020,2024
62,dive-into-machine-learning,dive-into-machine-learning,https://github.com/dive-into-machine-learning/dive-into-machine-learning,"Free ways to dive into machine learning with Python and Jupyter Notebook. Notebooks, courses, and other links. (First posted in 2016.)",11262,1913,Jupyter Notebook,2015-02-22,2024-10-02,0,2015,2024
63,Lhy_Machine_Learning,Fafa-DL,https://github.com/Fafa-DL/Lhy_Machine_Learning,李宏毅2021/2022/2023春季机器学习课程课件及作业,6079,1564,Jupyter Notebook,2021-02-28,2024-10-02,8,2021,2024
64,Deep-Learning,Robinwho,https://github.com/Robinwho/Deep-Learning,深度学习/人工智能/机器学习资料汇总(Deep Learning/Artificial Intelligent/Machine Learning) 持续更新……,407,130,Jupyter Notebook,2017-06-07,2024-09-19,0,2017,2024
65,Repo-2016,RubensZimbres,https://github.com/RubensZimbres/Repo-2016,"R, Python and Mathematica Codes in Machine Learning, Deep Learning, Artificial Intelligence, NLP and Geolocation",106,113,Python,2016-07-03,2024-02-09,0,2016,2024
66,3D-Machine-Learning,timzhang642,https://github.com/timzhang642/3D-Machine-Learning,A resource repository for 3D machine learning,9708,1784,Jupyter Notebook,2017-08-12,2024-10-02,21,2017,2024
67,Stock-Prediction-Models,huseinzol05,https://github.com/huseinzol05/Stock-Prediction-Models,Gathers machine learning and deep learning models for Stock forecasting including trading bots and simulations,7942,2810,Jupyter Notebook,2017-12-18,2024-10-02,52,2017,2024
68,machine-learning-course,instillai,https://github.com/instillai/machine-learning-course,:speech_balloon: Machine Learning Course with Python: ,7013,1260,Python,2019-02-15,2024-10-02,1,2019,2024
69,financial-machine-learning,firmai,https://github.com/firmai/financial-machine-learning,A curated list of practical financial machine learning tools and applications.,7021,1245,Python,2019-03-21,2024-10-02,6,2019,2024
70,machine-learning-roadmap,mrdbourke,https://github.com/mrdbourke/machine-learning-roadmap,"A roadmap connecting many of the most important concepts in machine learning, how to learn them and what tools to use to perform them.",7501,1170,Jupyter Notebook,2020-07-09,2024-10-02,12,2020,2024
71,industry-machine-learning,firmai,https://github.com/firmai/industry-machine-learning,A curated list of applied machine learning and data science notebooks and libraries across different industries (by @firmai),7229,1204,Jupyter Notebook,2019-05-03,2024-10-01,1,2019,2024
72,Machine-Learning-Specialization-Coursera,greyhatguy007,https://github.com/greyhatguy007/Machine-Learning-Specialization-Coursera, Contains Solutions and Notes for the Machine Learning Specialization By Stanford University and Deeplearning.ai - Coursera (2022) by Prof. Andrew NG,3526,2268,Jupyter Notebook,2022-06-16,2024-10-02,12,2022,2024
73,Machine-Learning-AndrewNg-DeepLearning.AI,azminewasi,https://github.com/azminewasi/Machine-Learning-AndrewNg-DeepLearning.AI,"Contains all course modules, exercises and notes of ML Specialization by Andrew Ng, Stanford Un. and DeepLearning.ai in Coursera",223,141,Jupyter Notebook,2022-07-24,2024-09-30,0,2022,2024
74,machine-learning-systems-design,chiphuyen,https://github.com/chiphuyen/machine-learning-systems-design,"A booklet on machine learning systems design with exercises. NOT the repo for the book ""Designing Machine Learning Systems""",8973,1415,HTML,2019-11-24,2024-10-02,10,2019,2024
75,machine-learning-yearning-cn,deeplearning-ai,https://github.com/deeplearning-ai/machine-learning-yearning-cn,Machine Learning Yearning 中文版 - 《机器学习训练秘籍》 - Andrew Ng 著,7740,1514,CSS,2018-06-19,2024-09-30,4,2018,2024
76,explainable_artificial_intelligence,dipanjanS,https://github.com/dipanjanS/explainable_artificial_intelligence,"Slides, code and resources for model interpretation methods in machine learning and deep learning",31,28,Jupyter Notebook,2019-08-08,2024-05-10,2,2019,2024
77,Artificial-Intelligence-Berkeley-CS188,molson194,https://github.com/molson194/Artificial-Intelligence-Berkeley-CS188,"Learned about search problems (A*, CSP, minimax), reinforcement learning, bayes nets, hidden markov models, and machine learning",113,57,Python,2016-06-20,2024-09-27,0,2016,2024
78,ML-From-Scratch,eriklindernoren,https://github.com/eriklindernoren/ML-From-Scratch,Machine Learning From Scratch. Bare bones NumPy implementations of machine learning models and algorithms with a focus on accessibility. Aims to cover everything from linear regression to deep learning.,23874,4584,Python,2017-02-05,2024-10-02,51,2017,2024
79,mlcourse.ai,Yorko,https://github.com/Yorko/mlcourse.ai,Open Machine Learning Course,9700,5666,Python,2017-02-27,2024-10-01,6,2017,2024
80,Machine-Learning-Session,shuhuai007,https://github.com/shuhuai007/Machine-Learning-Session,,5080,1088,Jupyter Notebook,2018-11-01,2024-09-26,20,2018,2024
81,machine-learning-book,rasbt,https://github.com/rasbt/machine-learning-book,Code Repository for Machine Learning with PyTorch and Scikit-Learn,3391,1236,Jupyter Notebook,2021-12-19,2024-10-02,27,2021,2024
82,Hands-on-Machine-Learning,DeqianBai,https://github.com/DeqianBai/Hands-on-Machine-Learning,A series of Jupyter notebooks with Chinese comment that walk you through the fundamentals of Machine Learning and Deep Learning in python using Scikit-Learn and TensorFlow.,1532,439,Jupyter Notebook,2018-10-18,2024-09-27,5,2018,2024
83,Learning-Scientific_Machine_Learning_Residual_Based_Attention_PINNs_DeepONets,jdtoscano94,https://github.com/jdtoscano94/Learning-Scientific_Machine_Learning_Residual_Based_Attention_PINNs_DeepONets,Physics Informed Machine Learning Tutorials (Pytorch and Jax),435,162,Jupyter Notebook,2022-04-04,2024-09-27,10,2022,2024
84,2022-Machine-Learning-Specialization,kaieye,https://github.com/kaieye/2022-Machine-Learning-Specialization,,4227,1616,Jupyter Notebook,2022-06-17,2024-10-02,24,2022,2024
85,awesome-blockchain-ai,steven2358,https://github.com/steven2358/awesome-blockchain-ai,A curated list of Blockchain projects for Artificial Intelligence and Machine Learning,909,138,Jupyter Notebook,2018-01-10,2024-09-23,2,2018,2024
86,machine-learning-cheat-sheet,soulmachine,https://github.com/soulmachine/machine-learning-cheat-sheet,Classical equations and diagrams in machine learning,7195,1233,TeX,2013-05-09,2024-10-01,11,2013,2024
87,numpy-ml,ddbourgin,https://github.com/ddbourgin/numpy-ml,"Machine learning, in numpy",15300,3712,Python,2019-04-06,2024-10-02,38,2019,2024
88,LearningX,ankonzoid,https://github.com/ankonzoid/LearningX,Deep & Classical Reinforcement Learning + Machine Learning Examples in Python,346,186,Python,2017-09-10,2024-09-14,7,2017,2024
89,Learn_Machine_Learning_in_3_Months,llSourcell,https://github.com/llSourcell/Learn_Machine_Learning_in_3_Months,"This is the code for ""Learn Machine Learning in 3 Months"" by Siraj Raval on Youtube ",7590,2379,Jupyter Notebook,2018-03-02,2024-09-27,19,2018,2024
90,Interactive_Tools,Machine-Learning-Tokyo,https://github.com/Machine-Learning-Tokyo/Interactive_Tools,"Interactive Tools for Machine Learning, Deep Learning and Math",2623,305,Jupyter Notebook,2019-04-29,2024-10-02,0,2019,2024
91,machine_learning_basics,zotroneneis,https://github.com/zotroneneis/machine_learning_basics,Plain python implementations of basic machine learning algorithms,4295,830,Jupyter Notebook,2018-02-19,2024-10-01,0,2018,2024
92,awesome-machine-learning-cn,jobbole,https://github.com/jobbole/awesome-machine-learning-cn,机器学习资源大全中文版，包括机器学习领域的框架、库以及软件,4171,1247,Jupyter Notebook,2015-11-03,2024-09-30,2,2015,2024
93,Machine-Learning-Interviews,alirezadir,https://github.com/alirezadir/Machine-Learning-Interviews,This repo is meant to serve as a guide for Machine Learning/AI technical interviews. ,4502,799,Jupyter Notebook,2021-01-31,2024-10-02,5,2021,2024
94,machine_learning_complete,Nyandwi,https://github.com/Nyandwi/machine_learning_complete,"A comprehensive machine learning repository containing 30+ notebooks on different concepts, algorithms and techniques.",4597,754,Jupyter Notebook,2021-09-25,2024-10-02,0,2021,2024
95,HsuanTienLin_MachineLearning,RedstoneWill,https://github.com/RedstoneWill/HsuanTienLin_MachineLearning,,2713,853,Jupyter Notebook,2018-05-05,2024-09-30,4,2018,2024
96,IntroductionToMachineLearningForSecurityPros,cylance,https://github.com/cylance/IntroductionToMachineLearningForSecurityPros,Example code for our book Introduction to Artificial Intelligence for Security Professionals,149,57,Python,2017-08-09,2024-09-18,5,2017,2024
97,MachineLearningStocks,robertmartin8,https://github.com/robertmartin8/MachineLearningStocks,Using python and scikit-learn to make stock predictions,1749,506,Python,2017-02-12,2024-10-02,15,2017,2024
98,Data-Analysis-and-Machine-Learning-Projects,rhiever,https://github.com/rhiever/Data-Analysis-and-Machine-Learning-Projects,"Repository of teaching materials, code, and data for my data analysis and machine learning projects.",6092,2055,Jupyter Notebook,2015-02-12,2024-10-02,11,2015,2024
99,Hyperparameter-Optimization-of-Machine-Learning-Algorithms,LiYangHart,https://github.com/LiYangHart/Hyperparameter-Optimization-of-Machine-Learning-Algorithms,Implementation of hyperparameter optimization/tuning methods for machine learning & deep learning models (easy&clear),1263,299,Jupyter Notebook,2020-07-23,2024-10-01,0,2020,2024
100,MachineLearning_notes,mdozmorov,https://github.com/mdozmorov/MachineLearning_notes,Machine learning and deep learning resources,496,74,Jupyter Notebook,2019-06-15,2024-09-26,0,2019,2024
