id,name,owner,url,description,stars,forks,language,created_at,updated_at,open_issues,create_year,update_year
761,MLResources,dlsucomet,https://github.com/dlsucomet/MLResources,"Repository for Machine Learning resources, frameworks, and projects. Managed by the DLSU Machine Learning Group.",475,222,Jupyter Notebook,2018-09-14,2024-10-02,0,2018,2024
762,cpsc330-2022W1,UBC-CS,https://github.com/UBC-CS/cpsc330-2022W1,CPSC 330: Applied Machine Learning,186,250,Jupyter Notebook,2020-01-31,2024-07-29,13,2020,2024
763,Machine-Learning-Algorithm,KangCai,https://github.com/KangCai/Machine-Learning-Algorithm,:star2:【Numpy 手写实现】SVM 支持向量机 | KNN K近邻 | Kmeans | Logistic Regression 逻辑回归 | Maximum Entropy 最大熵 | Naive Bayes 朴素贝叶斯 | Perception 感知机 | Decision Tree 决策树 | Random Forest 随机森林 | DBDT | GDA 高斯判别分析 | PCA 主成分分析 | LDA 线性判别分析  ,204,49,Python,2019-02-10,2024-09-12,3,2019,2024
764,Practical-Machine-Learning-With-Python,savan77,https://github.com/savan77/Practical-Machine-Learning-With-Python,Machine Learning Tutorials in Python,190,85,Jupyter Notebook,2017-05-31,2024-07-23,0,2017,2024
765,scikit-learn-book,gmonce,https://github.com/gmonce/scikit-learn-book,"Source code for the ""Learning scikit-learn: Machine Learning in Python""",392,267,Jupyter Notebook,2013-12-30,2024-09-26,0,2013,2024
766,machine-learning-scripts,CSCfi,https://github.com/CSCfi/machine-learning-scripts,Collection of scripts and tools related to machine learning,103,65,Jupyter Notebook,2016-11-25,2024-09-30,2,2016,2024
767,hector,xlvector,https://github.com/xlvector/hector,Golang machine learning lib,490,108,Go,2013-10-31,2024-09-30,9,2013,2024
768,rep,yandex,https://github.com/yandex/rep,Machine Learning toolbox for Humans,687,144,Jupyter Notebook,2015-04-13,2024-09-25,29,2015,2024
769,99-ML-Learning-Projects,gimseng,https://github.com/gimseng/99-ML-Learning-Projects,A list of 99 machine learning projects for anyone interested to learn from coding and building projects,595,175,Jupyter Notebook,2020-07-11,2024-09-22,112,2020,2024
770,Machine-Learning-Numpy,huseinzol05,https://github.com/huseinzol05/Machine-Learning-Numpy,"Gathers Machine learning models using pure Numpy to cover feed-forward, RNN, CNN, clustering, MCMC, timeseries, tree-based, and so much more!",109,64,Jupyter Notebook,2018-01-25,2024-09-19,0,2018,2024
771,Awesome-Machine-learning-Deep-learning-Deployment,ashishpatel26,https://github.com/ashishpatel26/Awesome-Machine-learning-Deep-learning-Deployment,Awesome Machine learning Deep learning Deployment,34,17,Jupyter Notebook,2019-08-14,2023-11-28,0,2019,2023
772,ML_Finance_Codes,mfrdixon,https://github.com/mfrdixon/ML_Finance_Codes,Machine Learning in Finance: From Theory to Practice Book,1784,486,Jupyter Notebook,2019-09-27,2024-10-01,5,2019,2024
773,Coursera_Reinforcement_Learning,futurev,https://github.com/futurev/Coursera_Reinforcement_Learning,Coursera Reinforcement Learning Specialization by by University of Alberta & Alberta Machine Intelligence Institute,0,160,Jupyter Notebook,2019-11-09,2023-11-09,0,2019,2023
774,dolly,databrickslabs,https://github.com/databrickslabs/dolly,"Databricks’ Dolly, a large language model trained on the Databricks Machine Learning Platform",10811,1154,Python,2023-03-24,2024-10-02,5,2023,2024
775,cml,iterative,https://github.com/iterative/cml,♾️ CML - Continuous Machine Learning | CI/CD for ML,4008,341,JavaScript,2020-02-26,2024-09-29,79,2020,2024
776,courseware-embedded-machine-learning,edgeimpulse,https://github.com/edgeimpulse/courseware-embedded-machine-learning,,184,66,Jupyter Notebook,2022-04-11,2024-09-30,2,2022,2024
777,machine-learning-regression,agrawal-priyank,https://github.com/agrawal-priyank/machine-learning-regression,"Built house price prediction model using linear regression and k nearest neighbors and used machine learning techniques like ridge, lasso, and gradient descent for optimization in Python",88,68,Jupyter Notebook,2017-04-29,2024-09-19,1,2017,2024
778,Using-machine-learning-to-detect-malicious-URLs,faizann24,https://github.com/faizann24/Using-machine-learning-to-detect-malicious-URLs,Machine Learning and Security | Using machine learning to detect malicious URLs,263,113,Python,2016-10-22,2024-08-12,5,2016,2024
779,machine-learning-exercise,nex3z,https://github.com/nex3z/machine-learning-exercise,"Python implementation of the programming assignment from Machine Learning class on Coursera, which is originally implemented in Matlab/Octave.",87,68,Jupyter Notebook,2017-01-23,2024-07-08,0,2017,2024
780,Automated-Machine-Learning,piyushpathak03,https://github.com/piyushpathak03/Automated-Machine-Learning,All AutoML Libraries,104,63,Jupyter Notebook,2020-05-31,2024-07-11,0,2020,2024
781,MachineLearningPractice,IronSpiderMan,https://github.com/IronSpiderMan/MachineLearningPractice,机器学习实战案例，涉及机器学习、深度学习等各个方向。每个案例代码量在百行左右。,186,31,Python,2023-09-25,2024-10-01,5,2023,2024
782,jetson-containers,dusty-nv,https://github.com/dusty-nv/jetson-containers,Machine Learning Containers for NVIDIA Jetson and JetPack-L4T,2182,446,Python,2020-04-29,2024-10-02,302,2020,2024
783,Machine-Learning-for-Imbalanced-Data,PacktPublishing,https://github.com/PacktPublishing/Machine-Learning-for-Imbalanced-Data,"Machine Learning for Imbalanced Data, published by Packt",258,74,Jupyter Notebook,2023-03-28,2024-09-14,2,2023,2024
784,deep-hedging,YuMan-Tam,https://github.com/YuMan-Tam/deep-hedging,Deep Hedging Demo - An Example of Using Machine Learning for Derivative Pricing.,149,52,Jupyter Notebook,2020-01-18,2024-10-01,3,2020,2024
785,Force-2020-Machine-Learning-competition,bolgebrygg,https://github.com/bolgebrygg/Force-2020-Machine-Learning-competition,"the results, code and the data for the Force 2020 Machine learning competition after the completion of the competition in October 2020.",136,95,Lasso,2020-07-28,2024-08-23,61,2020,2024
786,Machine-Learning-and-Data-Science,aditya1702,https://github.com/aditya1702/Machine-Learning-and-Data-Science,"This is a repository which contains all my work related Machine Learning, AI and Data Science. This includes my graduate projects, machine learning competition codes, algorithm implementations and reading material.",250,72,Jupyter Notebook,2017-06-23,2024-10-01,6,2017,2024
787,Machine-Learning-Book-Collections,ahammadmejbah,https://github.com/ahammadmejbah/Machine-Learning-Book-Collections,Machine learning is the study and development of data-driven strategies to enhance task performance. AI includes it.,160,68,Jupyter Notebook,2022-09-26,2024-10-01,0,2022,2024
788,Computational-Fluid-Dynamics-Machine-Learning-Examples,loliverhennigh,https://github.com/loliverhennigh/Computational-Fluid-Dynamics-Machine-Learning-Examples,This repo contains some tutorial type programs showing some basic ways machine learning can be applied to CFD.,272,90,Python,2017-08-09,2024-09-28,6,2017,2024
789,MachineLearningInJulia2020,ablaom,https://github.com/ablaom/MachineLearningInJulia2020,Resources for a 3.5 hour workshop on machine learning using the MLJ toolbox,142,32,Jupyter Notebook,2020-06-15,2024-07-25,0,2020,2024
790,Machine-Learning-from-Scratch,curiousily,https://github.com/curiousily/Machine-Learning-from-Scratch,"Succinct Machine Learning algorithm implementations from scratch in Python, solving real-world problems (Notebooks and Book). Examples of Logistic Regression, Linear Regression, Decision Trees, K-means clustering, Sentiment Analysis, Recommender Systems, Neural Networks and Reinforcement Learning.",166,64,Jupyter Notebook,2019-06-11,2024-09-27,0,2019,2024
791,gradio,gradio-app,https://github.com/gradio-app/gradio,"Build and share delightful machine learning apps, all in Python. ???? Star to support our work!",32482,2433,Python,2018-12-19,2024-10-02,556,2018,2024
792,MachineLearningSKLearn,DL-Academy,https://github.com/DL-Academy/MachineLearningSKLearn,,67,47,Jupyter Notebook,2020-05-09,2024-09-28,1,2020,2024
793,Python-for-Data-Science-and-Machine-Learning-Bootcamp,SuvroBaner,https://github.com/SuvroBaner/Python-for-Data-Science-and-Machine-Learning-Bootcamp,,147,198,Jupyter Notebook,2016-12-18,2024-09-18,0,2016,2024
794,mslearn-aml-labs,MicrosoftDocs,https://github.com/MicrosoftDocs/mslearn-aml-labs,Azure Machine Learning Lab Notebooks,203,227,Jupyter Notebook,2020-01-07,2024-06-22,0,2020,2024
795,iree,iree-org,https://github.com/iree-org/iree,A retargetable MLIR-based machine learning compiler and runtime toolkit.,2584,581,C++,2019-09-12,2024-10-02,1088,2019,2024
796,iir,shuyo,https://github.com/shuyo/iir,Machine Learning / Natural Language Processing / Information Retrieval,710,297,Python,2009-01-30,2024-09-07,15,2009,2024
797,imbalanced-learn,scikit-learn-contrib,https://github.com/scikit-learn-contrib/imbalanced-learn, A Python Package to Tackle the Curse of Imbalanced Datasets in Machine Learning,6815,1277,Python,2014-08-16,2024-10-02,48,2014,2024
798,python-dlpy,sassoftware,https://github.com/sassoftware/python-dlpy,The SAS Deep Learning Python (DLPy) package provides the high-level Python APIs to deep learning methods in SAS Visual Data Mining and Machine Learning. It allows users to build deep learning models using friendly Keras-like APIs. ,224,131,Python,2017-12-01,2024-09-04,22,2017,2024
799,Multi_Disease_Predictor,venugopalkadamba,https://github.com/venugopalkadamba/Multi_Disease_Predictor,A Machine Learning and Deep Learning based webapp used to predict multiple diseases.,111,63,Jupyter Notebook,2020-07-11,2024-09-26,5,2020,2024
800,applied-machine-learning-intensive,google,https://github.com/google/applied-machine-learning-intensive,Applied Machine Learning Intensive,144,68,Jupyter Notebook,2019-08-27,2024-09-10,0,2019,2024
801,learning-papers,daturkel,https://github.com/daturkel/learning-papers,Landmark Papers in Machine Learning,537,39,Jupyter Notebook,2019-12-03,2024-09-29,1,2019,2024
802,Machine-Learning-Resources,prodillo,https://github.com/prodillo/Machine-Learning-Resources,,104,59,Jupyter Notebook,2018-05-01,2024-07-24,1,2018,2024
803,PersonalizedMultitaskLearning,mitmedialab,https://github.com/mitmedialab/PersonalizedMultitaskLearning,"Code for performing 3 multitask machine learning methods: deep neural networks, Multitask Multi-kernel Learning (MTMKL), and a hierarchical Bayesian model (HBLR).",125,60,Python,2017-06-08,2024-08-28,2,2017,2024
804,fuel,mila-iqia,https://github.com/mila-iqia/fuel,A data pipeline framework for machine learning,867,268,Python,2015-02-12,2024-09-13,90,2015,2024
805,numl,sethjuarez,https://github.com/sethjuarez/numl,Machine Learning for .NET,430,104,C#,2012-02-21,2024-05-08,14,2012,2024
806,Machine_Learning-2,myLoveOneTwo,https://github.com/myLoveOneTwo/Machine_Learning-2,西瓜书，sklearn源码，李航统计学，机器学习实战,38,93,Jupyter Notebook,2020-03-06,2024-09-19,0,2020,2024
807,data,dataprofessor,https://github.com/dataprofessor/data,Data Sets for Machine Learning Practice,228,306,Jupyter Notebook,2019-11-29,2024-09-26,2,2019,2024
808,Accident-Detection-Model,shubhankar-shandilya-india,https://github.com/shubhankar-shandilya-india/Accident-Detection-Model,"Accident Detection Model using Deep Learning, OpenCV, Machine Learning, Artificial Intelligence.",44,4,Jupyter Notebook,2023-03-25,2024-09-25,2,2023,2024
809,non-overwhelming-machine-learning,kendricktan,https://github.com/kendricktan/non-overwhelming-machine-learning,A (non overwhelming) list of Machine Learning resources for beginners,626,35,Jupyter Notebook,2016-12-31,2024-08-12,0,2016,2024
810,yt-channels-DS-AI-ML-CS,benthecoder,https://github.com/benthecoder/yt-channels-DS-AI-ML-CS,"A comprehensive list of 180+ YouTube Channels for Data Science,  Data Engineering, Machine Learning, Deep learning, Computer Science, programming, software engineering, etc.",1291,138,Jupyter Notebook,2021-06-14,2024-09-23,1,2021,2024
811,AIML-2025,kirankumareranki,https://github.com/kirankumareranki/AIML-2025,Artificial Intelligence and Machine Learning Labs ,8,11,Jupyter Notebook,2024-07-29,2024-10-01,0,2024,2024
812,awesome-edge-machine-learning,Bisonai,https://github.com/Bisonai/awesome-edge-machine-learning,"A curated list of awesome edge machine learning resources, including research papers, inference engines, challenges, books, meetups and others.",249,52,Python,2019-06-27,2024-09-23,1,2019,2024
813,Python-Real-World-Machine-Learning,PacktPublishing,https://github.com/PacktPublishing/Python-Real-World-Machine-Learning,Code files added,97,103,Jupyter Notebook,2016-10-14,2024-07-22,3,2016,2024
814,Machine-Learning-Datasets,animesh-agarwal,https://github.com/animesh-agarwal/Machine-Learning-Datasets,A collection of all the datasets that I have analyzed and various algorithms used for training.,39,90,Jupyter Notebook,2018-10-01,2024-05-30,0,2018,2024
815,torchmetrics,Lightning-AI,https://github.com/Lightning-AI/torchmetrics,"Torchmetrics - Machine learning metrics for distributed, scalable PyTorch applications.",2097,402,Python,2020-12-22,2024-10-02,106,2020,2024
816,arXivTimes,arXivTimes,https://github.com/arXivTimes/arXivTimes,repository to research & share the machine learning articles,3889,201,Jupyter Notebook,2016-10-26,2024-09-30,2050,2016,2024
817,Machine-Learning-with-R-Third-Edition,PacktPublishing,https://github.com/PacktPublishing/Machine-Learning-with-R-Third-Edition,"Machine-Learning-with-R-Third-Edition, published by Packt",113,124,R,2019-03-18,2024-09-03,2,2019,2024
818,STMems_Machine_Learning_Core,STMicroelectronics,https://github.com/STMicroelectronics/STMems_Machine_Learning_Core,"Configuration files, examples and tools for the Machine Learning Core feature (MLC) available in STMicroelectronics MEMS sensors. Some examples of devices including MLC: LSM6DSOX, LSM6DSRX, ISM330DHCX, IIS2ICLX, LSM6DSO32X, ASM330LHHX, LSM6DSV16X, LIS2DUX12, LIS2DUXS12, LSM6DSV16BX, ASM330LHHXG1, LSM6DSV32X",167,62,C,2019-06-19,2024-09-12,0,2019,2024
819,intro_machine_learning,Prooffreader,https://github.com/Prooffreader/intro_machine_learning,"Introduction to Machine Learning, a series of IPython Notebook and accompanying slideshow and video",102,60,Jupyter Notebook,2015-01-29,2022-09-17,0,2015,2022
820,polyaxon,polyaxon,https://github.com/polyaxon/polyaxon,MLOps Tools For Managing & Orchestrating The Machine Learning LifeCycle,3555,313,Jupyter Notebook,2016-12-26,2024-09-29,122,2016,2024
821,awesome-ml4co,Thinklab-SJTU,https://github.com/Thinklab-SJTU/awesome-ml4co,Awesome machine learning for combinatorial optimization papers.,1641,197,Python,2021-03-21,2024-10-02,1,2021,2024
822,MLKits,StephenGrider,https://github.com/StephenGrider/MLKits, Starter projects for machine learning,207,209,JavaScript,2018-10-02,2024-09-01,5,2018,2024
823,MachineLearningSeminar,mim-uw,https://github.com/mim-uw/MachineLearningSeminar,Seminarium Magisterskie Machine Learning,24,69,Jupyter Notebook,2017-10-19,2024-06-13,1,2017,2024
824,pipelines-azureml,MicrosoftDocs,https://github.com/MicrosoftDocs/pipelines-azureml,Example Azure Pipeline to train and deploy a machine learning model using the Azure Machine Learning service,113,516,Python,2018-12-03,2024-09-25,11,2018,2024
825,MLPB,ben519,https://github.com/ben519/MLPB,Machine Learning Problem Bible | Problem Set Here >>,717,275,R,2016-06-13,2024-08-24,0,2016,2024
826,machine-learning-flashcards,jessicayung,https://github.com/jessicayung/machine-learning-flashcards,Machine learning flashcards,216,42,TeX,2018-07-31,2024-09-23,4,2018,2024
827,DataScienceNotebooks,mgroncki,https://github.com/mgroncki/DataScienceNotebooks,Tutorials about Machine Learning and Deep Learning,29,31,Jupyter Notebook,2018-05-18,2024-05-13,0,2018,2024
828,FastAPI-for-Machine-Learning-Live-Demo,FourthBrain,https://github.com/FourthBrain/FastAPI-for-Machine-Learning-Live-Demo,"This repository contains the files to build your very own AI image generation web application!  Outlined are the core components of the FastAPI web framework, and application leverage the newly-released Stable Diffusion text-to-image deep learning model.",160,47,Python,2022-12-15,2024-09-08,1,2022,2024
829,around-dataengineering,abhishek-ch,https://github.com/abhishek-ch/around-dataengineering,A Data Engineering & Machine Learning Knowledge Hub,1109,224,Python,2020-09-18,2024-09-27,2,2020,2024
830,skrub,skrub-data,https://github.com/skrub-data/skrub,Prepping tables for machine learning,1165,97,Python,2018-03-12,2024-10-02,59,2018,2024
831,Machine-Learning-Course-in-UCAS,Ming-Lian,https://github.com/Ming-Lian/Machine-Learning-Course-in-UCAS,国科大机器学习课程&机器学习笔记,230,68,Jupyter Notebook,2018-01-20,2024-09-27,2,2018,2024
832,Machine-Learning-for-Time-Series-Forecasting,FrancescaLazzeri,https://github.com/FrancescaLazzeri/Machine-Learning-for-Time-Series-Forecasting,,154,106,Jupyter Notebook,2020-12-11,2024-09-30,2,2020,2024
833,aiexperiments-drum-machine,googlecreativelab,https://github.com/googlecreativelab/aiexperiments-drum-machine,"Thousands of everyday sounds, organized using machine learning.",736,118,JavaScript,2016-11-10,2024-08-06,9,2016,2024
834,Stock-Market-Prediction-Web-App-using-Machine-Learning-And-Sentiment-Analysis,kaushikjadhav01,https://github.com/kaushikjadhav01/Stock-Market-Prediction-Web-App-using-Machine-Learning-And-Sentiment-Analysis,"Stock Market Prediction Web App based on Machine Learning and Sentiment Analysis of Tweets (API keys included in code). The front end of the Web App is based on Flask and Wordpress. The App forecasts stock prices of the next seven days for any given stock under NASDAQ or NSE as input by the user. Predictions are made using three algorithms: ARIMA, LSTM, Linear Regression. The Web App combines the predicted prices of the next seven days with the sentiment analysis of tweets to give recommendation whether the price is going to rise or fall",638,210,Python,2020-06-13,2024-10-02,22,2020,2024
835,Machine-Learning-Tutorial,dineshpiyasamara,https://github.com/dineshpiyasamara/Machine-Learning-Tutorial,"Machine learning is a method of data analysis that automates analytical model building. It is a branch of artificial intelligence based on the idea that systems can learn from data, identify patterns and make decisions with minimal human intervention.",10,26,Jupyter Notebook,2021-10-25,2024-06-20,0,2021,2024
836,Practice-of-Machine-Learning,PnYuan,https://github.com/PnYuan/Practice-of-Machine-Learning,"code of scattered practices when studying ""machine-learning"".",92,78,Python,2017-04-14,2024-02-24,1,2017,2024
837,grobid,kermitt2,https://github.com/kermitt2/grobid,A machine learning software for extracting information from scholarly documents,3458,445,Java,2012-09-13,2024-10-02,414,2012,2024
838,ML-University,d0r1h,https://github.com/d0r1h/ML-University,Machine Learning Open Source University,851,107,Jupyter Notebook,2020-08-29,2024-09-30,0,2020,2024
839,limdu,erelsgl,https://github.com/erelsgl/limdu,Machine-learning for Node.js,1054,99,JavaScript,2013-06-12,2024-09-15,7,2013,2024
840,introduction-to-machine-learning,gaih,https://github.com/gaih/introduction-to-machine-learning,,117,69,Jupyter Notebook,2021-06-09,2024-09-12,0,2021,2024
841,ILearnMachineLearning.js,SkalskiP,https://github.com/SkalskiP/ILearnMachineLearning.js,"Thanks to this project I could combine my knowledge from two areas: machine learning and web development. The whole application is written in React using TypeScript and Redux, but the engine that drives it is TensorFlow.js - a modern library for training and deploying machine learning models. ",164,59,TypeScript,2018-04-30,2024-09-05,40,2018,2024
842,bootcamp_machine-learning,42-AI,https://github.com/42-AI/bootcamp_machine-learning,Bootcamp to learn basics in Machine Learning,205,41,TeX,2019-11-01,2024-10-01,40,2019,2024
843,Machine-Learning-Engineering-with-Python-Second-Edition,PacktPublishing,https://github.com/PacktPublishing/Machine-Learning-Engineering-with-Python-Second-Edition,,179,125,HTML,2022-12-19,2024-09-26,46,2022,2024
844,awesome-machine-learning-engineer,superlinear-ai,https://github.com/superlinear-ai/awesome-machine-learning-engineer,???? A curated awesome list of Machine Learning Engineering resources. Feel free to contribute!,250,49,Jupyter Notebook,2018-04-09,2024-09-24,0,2018,2024
845,EconML,py-why,https://github.com/py-why/EconML,"ALICE (Automated Learning and Intelligence for Causation and Economics) is a Microsoft Research project aimed at applying Artificial Intelligence concepts to economic decision making. One of its  goals is to build a toolkit that combines state-of-the-art machine learning techniques with econometrics in order to bring automation to complex causal inference problems. To date, the ALICE Python SDK (econml) implements orthogonal machine learning algorithms such as the double machine learning work of Chernozhukov et al. This toolkit is designed to measure the causal effect of some treatment variable(s) t on an outcome variable y, controlling for a set of features x.",3766,713,Jupyter Notebook,2018-04-30,2024-10-02,365,2018,2024
846,introml,sdrangan,https://github.com/sdrangan/introml,Python tutorials for introduction to machine learning,261,397,Jupyter Notebook,2017-08-06,2024-09-19,3,2017,2024
847,machine_learning_flutter_app,theindianappguy,https://github.com/theindianappguy/machine_learning_flutter_app,Learn how to build a tensorflow model on Techable Machine and then run it on flutter app.,142,62,Dart,2019-12-18,2024-09-19,0,2019,2024
848,Machine-Learning-Operationalization,Azure-Samples,https://github.com/Azure-Samples/Machine-Learning-Operationalization,Deploying machine learning models to Azure,62,67,Jupyter Notebook,2017-04-10,2024-03-01,13,2017,2024
849,MachineLearningRemote-Unreal,getnamo,https://github.com/getnamo/MachineLearningRemote-Unreal,"Machine Learning plugin for the Unreal Engine, encapsulating calls to remote python servers running e.g. Tensorflow/Pytorch.",138,40,C++,2019-04-24,2024-08-10,12,2019,2024
850,Botnet-Detection-using-Machine-Learning,hmishra2250,https://github.com/hmishra2250/Botnet-Detection-using-Machine-Learning,Repository of Bachelor's Major Project on Botnet Detection,159,77,Jupyter Notebook,2016-12-08,2024-09-18,2,2016,2024
851,Python-Machine-Learning-By-Example,PacktPublishing,https://github.com/PacktPublishing/Python-Machine-Learning-By-Example,"Python Machine Learning By Example, published by Packt",114,89,Python,2017-05-29,2024-09-27,0,2017,2024
852,Retro-Learning-Environment,nadavbh12,https://github.com/nadavbh12/Retro-Learning-Environment,The Retro Learning Environment (RLE) -- a learning framework for AI,184,40,C++,2015-11-11,2024-09-25,5,2015,2024
853,Machine-Learning-with-Iris-Dataset,venky14,https://github.com/venky14/Machine-Learning-with-Iris-Dataset,Data Visualization and Machine Learning with Iris Dataset.,83,101,Jupyter Notebook,2017-08-02,2024-09-22,10,2017,2024
854,Machine-Learning-Samples,nikhilkumarsingh,https://github.com/nikhilkumarsingh/Machine-Learning-Samples,Machine learning algorithm code samples,9,156,Python,2017-05-08,2021-08-30,0,2017,2021
855,parallel_ml_tutorial,ogrisel,https://github.com/ogrisel/parallel_ml_tutorial,Tutorial on scikit-learn and IPython for parallel machine learning,1592,602,Jupyter Notebook,2013-01-10,2024-09-28,4,2013,2024
856,ArewaDS-Machine-Learning,arewadataScience,https://github.com/arewadataScience/ArewaDS-Machine-Learning,Arewa Data Science Machine Learning Curricula,35,113,Jupyter Notebook,2023-03-22,2024-09-23,0,2023,2024
857,Machine-learning-algorithm-PDF,piyushpathak03,https://github.com/piyushpathak03/Machine-learning-algorithm-PDF,,114,69,Jupyter Notebook,2021-05-07,2024-10-01,1,2021,2024
858,OptML_course,epfml,https://github.com/epfml/OptML_course,EPFL Course - Optimization for Machine Learning - CS-439,1122,311,Jupyter Notebook,2018-02-21,2024-10-01,4,2018,2024
859,Financial-Machine-Learning,JackBrady,https://github.com/JackBrady/Financial-Machine-Learning,"Notebook based on the book ""Advances in Financial Machine Learning"" by Marcos Lopez de Prado",118,52,Jupyter Notebook,2019-07-09,2024-07-19,0,2019,2024
860,machine_learning_notebook,583,https://github.com/583/machine_learning_notebook,机器学习纯算法实现。持续更新,76,62,Jupyter Notebook,2020-03-15,2024-09-10,0,2020,2024
861,submarine,apache,https://github.com/apache/submarine,Submarine is Cloud Native Machine Learning Platform.,691,254,Java,2019-09-19,2024-09-05,52,2019,2024
862,route-optimizer-machine-learning,vlazovskiy,https://github.com/vlazovskiy/route-optimizer-machine-learning,Route optimization solution which uses evolutionary algorithm with XGBoost model to optimize travel times.,131,62,Jupyter Notebook,2018-03-23,2024-09-24,2,2018,2024
863,transdim,xinychen,https://github.com/xinychen/transdim,Machine learning for transportation data imputation and prediction.,1193,298,Jupyter Notebook,2018-09-28,2024-09-30,23,2018,2024
864,Machine-Learning-with-Spark-Second-Edition,PacktPublishing,https://github.com/PacktPublishing/Machine-Learning-with-Spark-Second-Edition,"Machine Learning with Spark - Second Edition, by Packt",114,116,Scala,2017-04-28,2023-11-21,0,2017,2023
865,Applied-machine-learning-in-python,tianhuaiyuan,https://github.com/tianhuaiyuan/Applied-machine-learning-in-python,,73,104,Jupyter Notebook,2018-05-01,2024-02-17,2,2018,2024
866,MachineLearningSamples-PredictiveMaintenance,Azure-Samples,https://github.com/Azure-Samples/MachineLearningSamples-PredictiveMaintenance,MachineLearningSamples-PredictiveMaitenance,64,62,Jupyter Notebook,2017-09-12,2024-08-18,2,2017,2024
867,Machine-Learning-With-Go,PacktPublishing,https://github.com/PacktPublishing/Machine-Learning-With-Go,"Machine Learning With Go, published by Packt",132,61,Go,2017-09-25,2024-09-14,3,2017,2024
